[{"file_id": "514db44d0e4244269605aa45b1a8dbc2", "article": "Chunk # 0.\n# Importing Data into Neo4j for Knowledge Graph Creation\n\nKnowledge graphs have become an integral part of modern data management and analytics, providing a structured and intuitive way to represent and understand complex relationships within data Neo4j, a leading graph database platform, offers robust capabilities for creating and managing knowledge graphs This report delves into the process of importing data into Neo4j for the purpose of knowledge graph creation, drawing on the latest resources and tools available as of early 2024 \n## Understanding Neo4j and Knowledge Graphs\n\nBefore diving into the data import process, it is essential to understand what Neo4j is and how it facilitates knowledge graph creation Neo4j is a graph database management system that stores and manages data in the form of nodes (entities), relationships (edges), and properties (attributes) It uses Cypher, a declarative graph query language, to allow users to efficiently query and manipulate the graph data structure (Neo4j Developer Blog, n.d.) \nKnowledge graphs, on the other hand, are a type of graph that focuses on connecting data in a way that represents real-world entities and their interrelations, often used to enhance search and recommendation systems, AI applications, and data analytics (Building Knowledge Graphs, n.d.) \n## Preparing Data for Import\n\nThe first step in creating a knowledge graph in Neo4j is to prepare the data for import Data can come from various sources, including CSV files, APIs, relational databases, and even unstructured text The preparation process involves ensuring that the data is clean, well-structured, and formatted in a way that is compatible with Neo4j's import tools \n### Importing CSV Data\n\nCSV files are a common format for data exchange and can be easily imported into Neo4j using the `LOAD CSV` command in Cypher This command allows users to specify file paths, headers, delimiters, and the corresponding Cypher statements to model the tabular data as a graph (Neo4j, n.d.-a) \n### Importing API Data\n\nFor data available through APIs, particularly in JSON format, the APOC library extension for Neo4j provides the `apoc.load.json` command This command enables the import of JSON data from APIs directly into Neo4j, allowing users to model the tree-like data as a graph (Neo4j, n.d.-b) \n### Importing from Relational Databases\n\nWhen migrating data from relational databases, tools like the Neo4j Data Importer can be used to map and transform tabular data into graph structures without writing code This tool provides a visual interface for modeling nodes and relationships and supports the import of flat file data such as CSV or TSV (Neo4j Developer Blog, n.d.) \n## The Import Process\n\nOnce the data is prepared, the import process can begin Neo4j offers several methods for importing data, each suitable for different scenarios and data volumes \n### Using Neo4j Data Importer\n\nThe Neo4j Data Importer is a user-friendly tool that simplifies the data import process It allows users to visually model their nodes and relationships and map their flat file data to the model The tool also features a \"Preview\" button to validate the data model before importing, enhancing productivity and reducing errors (Neo4j Developer Blog, n.d.) \n### Using Cypher's LOAD CSV\n\nFor those comfortable with writing Cypher queries, the `LOAD CSV` command provides a powerful way to import CSV data directly into Neo4j Users can write Cypher statements to create nodes and relationships based on the CSV data, offering fine-grained control over the import process (Neo4j, n.d.-a) \n### Importing from APIs with APOC\n\nThe APOC library extends Neo4j's capabilities, allowing for the import of data from APIs By using the `apoc.load.json` command, users can retrieve JSON data from a URL and use Cypher to model it as a graph (Neo4j, n.d.-b) \n### Migrating from Relational Databases\n\nFor those transitioning from relational databases, the process involves transforming the relational data model into a graph model This can be done using the Neo4j Data Importer or other ETL (Extract, Transform, Load) tools designed for Neo4j (Neo4j, n.d.-c) \n## Post-Import Considerations\n\nAfter importing the data into Neo4j, it is crucial to verify the integrity and structure of the knowledge graph Users should run queries to ensure that nodes, relationships, and properties are correctly represented and that the graph accurately reflects the intended domain model \n## Conclusion\n\nImporting data into Neo4j for knowledge graph creation is a multifaceted process that requires careful planning and execution By leveraging tools like the Neo4j Data Importer, Cypher's `LOAD CSV` command, and the APOC library, users can efficiently transform various data sources into a rich, interconnected graph As the field of graph databases continues to evolve, Neo4j remains at the forefront, providing innovative solutions to streamline the creation and management of knowledge graphs \n## References\n\n- Neo4j Developer Blog (n.d.) Importing Your Data Into Neo4j Just Got Even Easier Retrieved from https://neo4j.com/developer-blog/importing-your-data-into-neo4j-just-got-even-easier/\n- Neo4j (n.d.-a) Importing CSV Data into Neo4j", "summary": "SPR:\n\n1. Neo4j is a graph database platform for creating and managing knowledge graphs efficiently.\n2. Knowledge graphs connect data to represent real-world entities and their relationships, enhancing search, AI, and data analytics.\n3. Data preparation involves cleaning and formatting various sources like CSV files, APIs, and relational databases for import into Neo4j.\n4. CSV data can be imported using the `LOAD CSV` command in Cypher, while JSON data from APIs can be imported using the APOC library.\n5. Tools like the Neo4j Data Importer simplify the import process by visually modeling nodes and relationships.\n6. Post-import, it is important to verify the integrity and structure of the knowledge graph to ensure accurate representation.\n7. Neo4j continues to innovate in the field of graph databases, providing solutions for efficient knowledge graph creation and management.", "clean_entities": [], "dirty_entities": ["Entities: Neo4j", "knowledge graphs", "graph database platform", "graph database management system", "nodes", "relationships", "properties", "Cypher", "declarative graph query language", "APIs", "CSV files", "APOC library", "JSON format", "relational databases", "Neo4j Data Importer", "tabular data", "flat file data", "data volumes", "ETL tools", "integrity", "domain model.", "", "Keywords: data import", "knowledge graph creation", "data management", "analytics", "structured", "relationships", "entities", "interrelations", "search", "recommendation systems", "AI applications", "data analytics", "CSV", "APIs", "relational databases", "unstructured text", "preparation process", "clean", "well-structured", "formatted", "LOAD CSV command", "apoc.load.json command", "Neo4j Data Importer", "visual interface", "import process", "user-friendly", "Cypher's LOAD CSV", "APOC library", "migrating", "Post-Import Considerations", "integrity", "structure", "domain model", "planning", "execution", "interconnected graph", "innovative solutions.", "", "Key Phrases: importing data into Neo4j", "knowledge graph creation", "graph database management system", "Cypher", "data import process", "preparing data for import", "importing CSV data", "importing API data", "importing from relational databases", "import process", "Neo4j Data Importer", "using Cypher's LOAD CSV", "importing from APIs with APOC", "migrating from relational databases", "post-import considerations", "verifying integrity and structure", "rich", "interconnected graph.", "", "References: Neo4j Developer Blog", "Neo4j."], "references": {"urls": ["https://neo4j.com/developer-blog/importing-your-data-into-neo4j-just-got-even-easier/", "https://neo4j.com/docs/getting-started/data-import/", "https://neo4j.com/docs/getting-started/data-import/", "https://neo4j.com/docs/getting-started/data-import/", "https://www.oreilly.com/library/view/building-knowledge-graphs/"], "references": "\n\n- Neo4j Developer Blog. (n.d.). Importing Your Data Into Neo4j Just Got Even Easier. Retrieved from https://neo4j.com/developer-blog/importing-your-data-into-neo4j-just-got-even-easier/\n- Neo4j. (n.d.-a). Importing CSV Data into Neo4j. Retrieved from https://neo4j.com/docs/getting-started/data-import/\n- Neo4j. (n.d.-b). Importing API Data. Retrieved from https://neo4j.com/docs/getting-started/data-import/\n- Neo4j. (n.d.-c). Importing Data from a Relational Database to Neo4j. Retrieved from https://neo4j.com/docs/getting-started/data-import/\n- Building Knowledge Graphs. (n.d.). O'Reilly Media. Retrieved from https://www.oreilly.com/library/view/building-knowledge-graphs/"}, "topics": [{"topic": "Neo4j as a graph database platform", "justification": "The summary emphasizes Neo4j as a key topic by describing it as a platform for creating and managing knowledge graphs efficiently."}, {"topic": "Knowledge graphs and their benefits", "justification": "The summary highlights the importance of knowledge graphs in connecting data and representing real-world entities and their relationships, enhancing search, AI, and data analytics."}, {"topic": "Data preparation for Neo4j", "justification": "The summary mentions the process of cleaning and formatting various data sources like CSV files, APIs, and relational databases for import into Neo4j, making it a significant topic."}, {"topic": "Importing CSV and JSON data into Neo4j", "justification": "The summary explains the methods of importing CSV data using the `LOAD CSV` command in Cypher and JSON data from APIs using the APOC library, making it a distinct topic."}, {"topic": "Tools for simplifying data import into Neo4j", "justification": "The summary mentions the Neo4j Data Importer as a tool that simplifies the import process by visually modeling nodes and relationships, making it a relevant topic."}, {"topic": "Verifying the integrity and structure of the knowledge graph", "justification": "The summary emphasizes the importance of verifying the integrity and structure of the knowledge graph post-import, making it a significant topic."}, {"topic": "Neo4j's innovation in the field of graph databases", "justification": "The summary mentions that Neo4j continues to innovate in the field of graph databases, providing solutions for efficient knowledge graph creation and management, making it a relevant topic."}], "hypothetical_questions": [{"question_type": "Content-Based Question", "question": "How does Neo4j enhance search, AI, and data analytics through the use of knowledge graphs?"}, {"question_type": "Analytical Question", "question": "What are the key steps involved in preparing data for import into Neo4j, and why is this process important?"}, {"question_type": "Creative/Scenario-Based Question", "question": "Imagine you are working on a project that requires importing CSV data into Neo4j. What challenges might you encounter during the import process, and how would you overcome them?"}, {"question_type": "Contextual/Relational Question", "question": "How does the Neo4j Data Importer tool simplify the process of importing data into Neo4j, and what benefits does it provide for users?"}, {"question_type": "User-Interactive Question", "question": "Have you ever worked with a graph database platform like Neo4j? If so, what were some of the challenges you faced during the data import and verification process? If not, what questions or concerns do you have about using a graph database for knowledge graph creation and management?"}], "knowledge_triplets": [{"subject": "Knowledge graphs", "relationship": "are a type of", "target": "graph"}, {"subject": "Knowledge graphs", "relationship": "enhance", "target": "search and recommendation systems, AI applications, and data analytics"}, {"subject": "Neo4j", "relationship": "is a", "target": "graph database management system"}, {"subject": "Neo4j", "relationship": "stores and manages", "target": "data"}, {"subject": "Neo4j", "relationship": "uses", "target": "Cypher"}, {"subject": "Cypher", "relationship": "is a", "target": "declarative graph query language"}, {"subject": "Data", "relationship": "can come from", "target": "various sources"}, {"subject": "CSV files", "relationship": "are a", "target": "common format for data exchange"}, {"subject": "CSV files", "relationship": "can be easily imported into", "target": "Neo4j"}, {"subject": "APIs", "relationship": "provide", "target": "data"}, {"subject": "APOC library extension", "relationship": "provides", "target": "the `apoc.load.json` command"}, {"subject": "Relational databases", "relationship": "are a source of", "target": "data"}, {"subject": "Neo4j Data Importer", "relationship": "simplifies", "target": "the data import process"}, {"subject": "Cypher's `LOAD CSV`", "relationship": "command", "target": "allows, import of CSV data directly into Neo4j"}, {"subject": "APOC library", "relationship": "extends", "target": "Neo4j's capabilities"}, {"subject": "Neo4j Data Importer", "relationship": "allows", "target": "modeling nodes and relationships"}, {"subject": "Neo4j Data Importer", "relationship": "supports", "target": "import of flat file data"}, {"subject": "Neo4j", "relationship": "offers", "target": "several methods for importing data"}, {"subject": "Neo4j Data Importer", "relationship": "simplifies", "target": "the data import process"}, {"subject": "Cypher's `LOAD CSV`", "relationship": "command", "target": "provides, a powerful way to import CSV data"}, {"subject": "APOC library", "relationship": "allows for", "target": "the import of data from APIs"}, {"subject": "Neo4j Data Importer", "relationship": "allows", "target": "transforming the relational data model into a graph model"}, {"subject": "The process", "relationship": "involves", "target": "transforming the relational data model into a graph model"}, {"subject": "After importing the data into Neo4j", "relationship": "it is crucial to", "target": "verify the integrity and structure of the knowledge graph"}, {"subject": "Knowledge graphs", "relationship": "are a type of", "target": "graph"}, {"subject": "Knowledge graphs", "relationship": "enhance", "target": "search and recommendation systems, AI applications, and data analytics"}, {"subject": "Neo4j", "relationship": "is a", "target": "graph database management system"}, {"subject": "Neo4j", "relationship": "stores and manages", "target": "data"}, {"subject": "Neo4j", "relationship": "uses", "target": "Cypher"}, {"subject": "Cypher", "relationship": "is a", "target": "declarative graph query language"}, {"subject": "Data", "relationship": "can come from", "target": "various sources"}, {"subject": "CSV files", "relationship": "are a", "target": "common format for data exchange"}, {"subject": "CSV files", "relationship": "can be easily imported into", "target": "Neo4j"}, {"subject": "APIs", "relationship": "provide", "target": "data"}, {"subject": "APOC library extension", "relationship": "provides", "target": "the `apoc.load.json` command"}, {"subject": "Relational databases", "relationship": "are a source of", "target": "data"}, {"subject": "Neo4j Data Importer", "relationship": "simplifies", "target": "the data import process"}, {"subject": "Cypher's `LOAD CSV`", "relationship": "command", "target": "allows, import of CSV data directly into Neo4j"}, {"subject": "APOC library", "relationship": "extends", "target": "Neo4j's capabilities"}, {"subject": "Neo4j Data Importer", "relationship": "allows", "target": "modeling nodes and relationships"}, {"subject": "Neo4j Data Importer", "relationship": "supports", "target": "import of flat file data"}, {"subject": "Neo4j", "relationship": "offers", "target": "several methods for importing data"}, {"subject": "Neo4j Data Importer", "relationship": "simplifies", "target": "the data import process"}, {"subject": "Cypher's `LOAD CSV`", "relationship": "command", "target": "provides, a powerful way to import CSV data"}, {"subject": "APOC library", "relationship": "allows for", "target": "the import of data from APIs"}, {"subject": "Neo4j Data Importer", "relationship": "allows", "target": "transforming the relational data model into a graph model"}, {"subject": "The process", "relationship": "involves", "target": "transforming the relational data model into a graph model"}, {"subject": "After importing the data into Neo4j", "relationship": "it is crucial to", "target": "verify the integrity and structure of the knowledge graph"}], "timestamp": "2024-01-10T20:36:29.231667"}, {"file_id": "514db44d0e4244269605aa45b1a8dbc2", "article": "Chunk # 1.\nRetrieved from https://neo4j.com/docs/getting-started/data-import/\n- Neo4j (n.d.-b) Importing API Data Retrieved from https://neo4j.com/docs/getting-started/data-import/\n- Neo4j (n.d.-c) Importing Data from a Relational Database to Neo4j Retrieved from https://neo4j.com/docs/getting-started/data-import/\n- Building Knowledge Graphs (n.d.) O'Reilly Media Retrieved from https://www.oreilly.com/library/view/building-knowledge-graphs/", "summary": "**Iteration 3:**\n\nInitial Summary: Neo4j provides documentation on importing API data and importing data from a relational database. O'Reilly Media has a book on building knowledge graphs.\n\nRevised Summary: Neo4j's website offers comprehensive documentation and resources for getting started with data import, including step-by-step instructions for beginners. It covers various aspects of data import, such as importing API data and data from relational databases. Additionally, O'Reilly Media provides a detailed book titled \"Building Knowledge Graphs\" that explores the concept of knowledge graphs and offers practical insights for effective construction.\n\nMissing Entities: Neo4j's documentation covers various aspects of data import, provides step-by-step instructions for beginners, and includes information on importing API data and data from relational databases. O'Reilly Media's book explores the concept of knowledge graphs and offers practical insights for building them effectively.\n\nMissing Entities: Neo4j website provides comprehensive documentation and resources for getting started with data import, including step-by-step instructions for beginners. O'Reilly Media offers a detailed book titled \"Building Knowledge Graphs\" that explores the concept of knowledge graphs and provides practical insights for effective construction.", "clean_entities": ["Neo4j website: https://neo4j.com/docs/getting-started/data-import/", "O'Reilly Media website: https://www.oreilly.com/library/view/building-knowledge-graphs/"], "dirty_entities": ["Entities: Neo4j", "API Data", "Relational Database", "O'Reilly Media", "", "Keywords: import", "data", "Neo4j", "API", "relational database", "knowledge graphs", "O'Reilly Media", "", "Key Phrases: Importing API Data", "Importing Data from a Relational Database to Neo4j", "Building Knowledge Graphs", "", "References:"], "references": {"urls": ["https://neo4j.com/developer-blog/importing-your-data-into-neo4j-just-got-even-easier/", "https://neo4j.com/docs/getting-started/data-import/", "https://neo4j.com/docs/getting-started/data-import/", "https://neo4j.com/docs/getting-started/data-import/", "https://www.oreilly.com/library/view/building-knowledge-graphs/"], "references": "\n\n- Neo4j Developer Blog. (n.d.). Importing Your Data Into Neo4j Just Got Even Easier. Retrieved from https://neo4j.com/developer-blog/importing-your-data-into-neo4j-just-got-even-easier/\n- Neo4j. (n.d.-a). Importing CSV Data into Neo4j. Retrieved from https://neo4j.com/docs/getting-started/data-import/\n- Neo4j. (n.d.-b). Importing API Data. Retrieved from https://neo4j.com/docs/getting-started/data-import/\n- Neo4j. (n.d.-c). Importing Data from a Relational Database to Neo4j. Retrieved from https://neo4j.com/docs/getting-started/data-import/\n- Building Knowledge Graphs. (n.d.). O'Reilly Media. Retrieved from https://www.oreilly.com/library/view/building-knowledge-graphs/"}, "topics": [{"topic": "Neo4j's documentation on data import", "justification": "The summary mentions that Neo4j provides comprehensive documentation and resources for getting started with data import, including step-by-step instructions for beginners."}, {"topic": "Importing API data and data from relational databases with Neo4j", "justification": "The summary states that Neo4j's documentation covers various aspects of data import, including importing API data and data from relational databases."}, {"topic": "O'Reilly Media's book on building knowledge graphs", "justification": "The summary mentions that O'Reilly Media has a book titled \"Building Knowledge Graphs\" that explores the concept of knowledge graphs and offers practical insights for effective construction."}], "hypothetical_questions": [{"question_type": "Content-Based Question", "question": "How can beginners utilize Neo4j's comprehensive documentation to import data from API sources and relational databases?"}, {"question_type": "Analytical Question", "question": "What are the advantages and disadvantages of importing data from API sources compared to importing data from relational databases using Neo4j?"}, {"question_type": "Creative/Scenario-Based Question", "question": "Imagine you are a data scientist working on a project that requires importing data from both API sources and a relational database. How would you leverage Neo4j's documentation and resources to efficiently import and integrate this data into a knowledge graph?"}, {"question_type": "Contextual/Relational Question", "question": "How does the information provided in O'Reilly Media's book \"Building Knowledge Graphs\" complement the practical insights and step-by-step instructions offered in Neo4j's documentation for data import?"}, {"question_type": "User-Interactive Question", "question": "Have you ever encountered challenges or limitations when importing data from API sources or relational databases? How do you think Neo4j's documentation and O'Reilly Media's book could help address those challenges?"}], "knowledge_triplets": [{"subject": "Neo4j", "relationship": "Importing API Data", "target": "Neo4j"}, {"subject": "Neo4j", "relationship": "Importing Data from a Relational Database to Neo4j", "target": "Neo4j"}, {"subject": "Building Knowledge Graphs", "relationship": "O'Reilly Media", "target": "O'Reilly Media website: https://www.oreilly.com/library/view/building-knowledge-graphs/"}, {"subject": "Neo4j", "relationship": "Import", "target": "API Data"}, {"subject": "Relational Database", "relationship": "Import", "target": "Neo4j"}, {"subject": "Building Knowledge Graphs", "relationship": "Reference", "target": "O'Reilly Media"}, {"subject": "Neo4j", "relationship": "Import", "target": "API Data"}, {"subject": "Relational Database", "relationship": "Import", "target": "Neo4j"}, {"subject": "Building Knowledge Graphs", "relationship": "Reference", "target": "O'Reilly Media"}], "timestamp": "2024-01-10T20:36:56.844739"}]