[{"file_id": "76725ca31bcc4918b4b806f0493de4e9", "article": "Chunk # 0.\n# Synthetic Environments for Mitochondrial ATP Production\n\n## Introduction\n\nAdenosine triphosphate (ATP) is the primary energy currency of the cell, and its synthesis is a fundamental process for life Mitochondria, often referred to as the powerhouses of the cell, are the primary site for ATP production through oxidative phosphorylation (OXPHOS) The intricate process of ATP synthesis within mitochondria is a topic of extensive research, particularly in the context of mitochondrial diseases and cellular energy demands This report delves into the creation and analysis of synthetic environments for mitochondrial ATP production, drawing on recent scientific findings and technological advancements \n## Mitochondrial ATP Synthase and Disease Management\n\nThe mitochondrial F1Fo-ATP synthase is a complex enzyme that synthesizes ATP using a rotary mechanism powered by the proton gradient across the mitochondrial inner membrane (Acin-Perez et al., 2023) This gradient is established by the electron transport chain (ETC), which acts as an electro-electric converter, accepting electrons from various sources to produce the correct voltage for ATP production (Bagkos, Koufopoulos, & Piperi, 2014) The ETC's ability to generate a mitochondrial membrane potential (MMP) of approximately 3x10^7 V/m is crucial for the function of F1Fo ATP synthase (Bagkos et al., 2014) \nRecent studies have highlighted the potential of targeting ATP synthase for the management of mitochondrial diseases For instance, the selective inhibition of ATP hydrolysis without affecting ATP synthesis has been shown to have therapeutic benefits in disease models (Acin-Perez et al., 2023) This novel approach could prevent the ATP synthase from operating in reverse, which is a significant concern in mitochondrial and age-related diseases \n## Computational Frameworks and Mitochondrial ATP Synthesis\n\nThe development of computational frameworks has been instrumental in analyzing and simulating mitochondrial ATP synthesis These frameworks employ thermodynamic and kinetic principles to model the processes of the ETC, ATP synthase, and transporters for phosphate and adenine nucleotides By integrating models of these discrete processes, researchers can simulate in vitro respirometry experiments and explain cardiac respiratory control in vivo (Beard's Lab, n.d.) Such computational tools are not only valuable for research but also for educational purposes, offering a deeper understanding of mitochondrial function \n## Spatial and Temporal Dynamics of ATP Synthase\n\nThe spatial and temporal dynamics of ATP synthase are critical for cellular function Recent research has shown that mitochondrial dynamics, such as fission, can influence the translocation of ATP synthase to the plasma membrane (PM) This translocation involves the association of the ATP synthase complex with microtubules and its delivery to the cell surface, where it can potentially influence extracellular ATP (eATP) levels (Chang et al., 2023) Understanding these dynamics is essential for comprehending the role of ATP synthase in various cellular contexts, including cancer \n## Mitochondrial Morphology and ATP Production\n\nMitochondrial morphology is another factor that affects ATP production Studies have used detailed mitochondrial models to investigate how specific morphologies, such as those found in synaptic mitochondria, influence ATP production capacity While morphology appears to have minor effects on ATP production in equilibrium steady-state conditions, it can significantly impact energy buffering mechanisms in non-equilibrium, physiologically relevant conditions (Brand et al., 2020) This finding underscores the importance of considering mitochondrial morphology in studies of bioenergetic function \n## Therapeutic Targeting of ATP Synthase\n\nThe ATP synthase/IF1 axis has emerged as a potential therapeutic target for cognitive deficits associated with neurodegenerative and age-associated pathologies Genetic studies have demonstrated the role of IF1 as an inhibitor of mitochondrial ATP synthase under physiological conditions, suggesting that modulation of this axis could influence neuronal, synaptic, and cognitive functions (PLOS Biology, n.d.) \n## Conclusion\n\nThe creation and analysis of synthetic environments for mitochondrial ATP production are at the forefront of bioenergetic research The ability to manipulate ATP synthase activity, either through selective inhibition or genetic modification, offers promising avenues for the treatment of mitochondrial diseases and the enhancement of cellular energy efficiency Computational models and detailed analyses of mitochondrial morphology and dynamics provide valuable insights into the fundamental processes of ATP synthesis As research continues to unravel the complexities of mitochondrial function, the potential for novel therapeutic strategies and a deeper understanding of cellular energetics becomes increasingly apparent \n## References\n\n- Acin-Perez, R., et al (2023) The mitochondrial F1Fo-ATP synthase uses a rotary mechanism to synthesise ATP University College London, London, UK https://www.ncbi.nlm.nih.gov/pmc/articles/PMC10183815/\n- Bagkos, G., Koufopoulos, K., & Piperi, C (2014) ATP Synthesis Revisited: New Avenues for the Management of Mitochondrial Diseases Current Pharmaceutical Design, 20(28) https://dx.doi.org/10.2174/1381612819666131230124334\n- Beard's Lab (n.d.) A computational framework for analyzing and simulating mitochondrial ATP synthesis https://beards-lab.github.io/QAMAS_book/\n- Brand, M D., et al (2020) Efficiency of ATP production differs by substrate and tissue https://www.nature.com/articles/s41598-019-54159-1\n- Chang, Y W., Tony Yang, T., Chen, M C., et al (2023) Spatial and temporal dynamics of ATP synthase from mitochondria toward the cell surface Communications Biology, 6, 427 https://doi.org/10.1038/s42003-023-04785-3\n- PLOS Biology (n.d.)", "summary": "Revised Summary: Mitochondrial ATP synthesis and cellular energy demands are key topics in bioenergetic research. ATP, the energy currency of cells, is produced within mitochondria through ATP synthesis. This process relies on the proton gradient across the mitochondrial inner membrane and the electron transport chain. Thermodynamic and kinetic principles govern ATP hydrolysis without affecting ATP synthesis. The spatial and temporal dynamics of ATP synthase play a crucial role in cellular energetics. Understanding these mechanisms has implications for disease management, particularly in neurodegenerative and age-associated pathologies. Therapeutic targeting of ATP synthase holds promise for addressing cognitive deficits. Computational frameworks aid in analyzing and simulating mitochondrial ATP synthesis, contributing to novel therapeutic strategies and a deeper understanding of cellular energetics. Synthetic environments for mitochondrial ATP production offer opportunities for further research and technological advancements.", "clean_entities": ["Adenosine triphosphate (ATP)", "Mitochondria", "Oxidative phosphorylation (OXPHOS)", "Mitochondrial F1Fo-ATP synthase", "Proton gradient", "Electron transport chain (ETC)", "Mitochondrial membrane potential (MMP)", "ATP hydrolysis", "Computational frameworks", "Thermodynamic and kinetic principles", "In vitro respirometry experiments", "Cardiac respiratory control", "Mitochondrial dynamics", "Fission", "Plasma membrane (PM)", "Microtubules", "Extracellular ATP (eATP)", "Mitochondrial morphology", "Energy buffering mechanisms", "ATP synthase/IF1 axis", "Cognitive deficits", "Neurodegenerative and age-associated pathologies", "Genetic modification", "Synthetic environments", "Mitochondrial ATP production", "Mitochondrial diseases", "Cellular energy demands", "Scientific findings", "Technological advancements", "Disease management", "Computational frameworks", "Mitochondrial ATP synthesis", "Spatial and temporal dynamics", "Mitochondrial morphology", "Therapeutic targeting", "Cognitive deficits", "Bioenergetic research", "Cellular energetics", "Mitochondria as powerhouses of the cell", "ATP synthesis within mitochondria", "Mitochondrial diseases and cellular energy demands", "Synthetic environments for mitochondrial ATP production", "Mitochondrial ATP synthase and disease management", "Proton gradient across the mitochondrial inner membrane", "Electron transport chain as an electro-electric converter", "ATP hydrolysis without affecting ATP synthesis", "Computational frameworks for analyzing and simulating mitochondrial ATP synthesis", "Spatial and temporal dynamics of ATP synthase", "Mitochondrial morphology and ATP production", "Therapeutic targeting of ATP synthase for cognitive deficits", "Novel therapeutic strategies and a deeper understanding of cellular energetics", "Acin-Perez", "Bagkos", "Beard's Lab (n.d.) A computational framework for analyzing and simulating mitochondrial ATP synthesis", "Brand", "Chang", "PLOS Biology (n.d.)"], "dirty_entities": ["Entities:", "", "Keywords:", "", "Key Phrases:", "", "References:", "R.", "et al (2023) The mitochondrial F1Fo-ATP synthase uses a rotary mechanism to synthesise ATP", "G.", "Koufopoulos", "K.", "& Piperi", "C (2014) ATP Synthesis Revisited: New Avenues for the Management of Mitochondrial Diseases", "M D.", "et al (2020) Efficiency of ATP production differs by substrate and tissue", "Y W.", "Tony Yang", "T.", "Chen", "M C.", "et al (2023) Spatial and temporal dynamics of ATP synthase from mitochondria toward the cell surface"], "references": {"urls": ["https://www.ncbi.nlm.nih.gov/pmc/articles/PMC10183815/", "https://dx.doi.org/10.2174/1381612819666131230124334", "https://beards-lab.github.io/QAMAS_book/", "https://www.nature.com/articles/s41598-019-54159-1", "https://doi.org/10.1038/s42003-023-04785-3", "https://journals.plos.org/plosbiology/article?id=10.1371/journal.pbio.3001252"], "references": "\n\n- Acin-Perez, R., et al. (2023). The mitochondrial F1Fo-ATP synthase uses a rotary mechanism to synthesise ATP. University College London, London, UK. https://www.ncbi.nlm.nih.gov/pmc/articles/PMC10183815/\n- Bagkos, G., Koufopoulos, K., & Piperi, C. (2014). ATP Synthesis Revisited: New Avenues for the Management of Mitochondrial Diseases. Current Pharmaceutical Design, 20(28). https://dx.doi.org/10.2174/1381612819666131230124334\n- Beard's Lab. (n.d.). A computational framework for analyzing and simulating mitochondrial ATP synthesis. https://beards-lab.github.io/QAMAS_book/\n- Brand, M. D., et al. (2020). Efficiency of ATP production differs by substrate and tissue. https://www.nature.com/articles/s41598-019-54159-1\n- Chang, Y. W., Tony Yang, T., Chen, M. C., et al. (2023). Spatial and temporal dynamics of ATP synthase from mitochondria toward the cell surface. Communications Biology, 6, 427. https://doi.org/10.1038/s42003-023-04785-3\n- PLOS Biology. (n.d.). The role of IF1 in the regulation of mitochondrial ATP synthase. https://journals.plos.org/plosbiology/article?id=10.1371/journal.pbio.3001252"}, "topics": [{"topic": "Mitochondrial ATP synthesis", "justification": "The summary emphasizes the importance of mitochondrial ATP synthesis in bioenergetic research and cellular energy demands."}, {"topic": "Proton gradient and electron transport chain", "justification": "The summary mentions that ATP synthesis relies on the proton gradient across the mitochondrial inner membrane and the electron transport chain, indicating their significance in the process."}, {"topic": "Thermodynamic and kinetic principles of ATP hydrolysis", "justification": "The summary states that ATP hydrolysis does not affect ATP synthesis, highlighting the relevance of thermodynamic and kinetic principles in this context."}, {"topic": "Spatial and temporal dynamics of ATP synthase", "justification": "The summary mentions that the spatial and temporal dynamics of ATP synthase play a crucial role in cellular energetics, indicating the importance of this topic."}, {"topic": "Implications for disease management, particularly in neurodegenerative and age-associated pathologies", "justification": "The summary states that understanding the mechanisms of ATP synthesis has implications for disease management, specifically in neurodegenerative and age-associated pathologies, highlighting the relevance of this topic."}, {"topic": "Therapeutic targeting of ATP synthase", "justification": "The summary suggests that therapeutic targeting of ATP synthase holds promise for addressing cognitive deficits, indicating the significance of this topic."}, {"topic": "Computational frameworks for analyzing and simulating mitochondrial ATP synthesis", "justification": "The summary mentions that computational frameworks aid in analyzing and simulating mitochondrial ATP synthesis, indicating the relevance of this topic."}, {"topic": "Synthetic environments for mitochondrial ATP production", "justification": "The summary states that synthetic environments for mitochondrial ATP production offer opportunities for further research and technological advancements, highlighting the importance of this topic."}], "hypothetical_questions": [{"question_type": "Content-Based Question", "question": "How does ATP synthesis occur within mitochondria, and what are the key factors involved in this process?"}, {"question_type": "Analytical Question", "question": "What are the thermodynamic and kinetic principles that govern ATP hydrolysis, and how do they differ from those governing ATP synthesis?"}, {"question_type": "Creative/Scenario-Based Question", "question": "Imagine a scenario where the spatial and temporal dynamics of ATP synthase are disrupted. How might this impact cellular energetics and overall cellular function?"}, {"question_type": "Contextual/Relational Question", "question": "How does understanding the mechanisms of ATP synthesis in mitochondria contribute to the development of therapeutic strategies for neurodegenerative and age-associated pathologies?"}, {"question_type": "User-Interactive Question", "question": "How might computational frameworks and synthetic environments for mitochondrial ATP production be used to engage students in bioenergetic research and enhance their understanding of cellular energetics?"}], "knowledge_triplets": [{"subject": "Adenosine triphosphate (ATP)", "relationship": "is the primary energy currency of", "target": "the cell"}, {"subject": "Mitochondria", "relationship": "are referred to as", "target": "the powerhouses of the cell"}, {"subject": "Mitochondria", "relationship": "are the primary site for", "target": "ATP production through oxidative phosphorylation (OXPHOS"}, {"subject": "ATP synthesis", "relationship": "is a fundamental process for", "target": "life"}, {"subject": "Mitochondrial F1Fo-ATP synthase", "relationship": "synthesizes ATP using", "target": "a rotary mechanism powered by the proton gradient across the mitochondrial inner membrane"}, {"subject": "Proton gradient", "relationship": "is established by", "target": "the electron transport chain (ETC"}, {"subject": "Electron transport chain (ETC)", "relationship": "accepts electrons from various sources to produce the correct voltage for", "target": "ATP production"}, {"subject": "Mitochondrial membrane potential (MMP)", "relationship": "is crucial for the function of", "target": "F1Fo ATP synthase"}, {"subject": "ATP hydrolysis", "relationship": "can be selectively inhibited without affecting", "target": "ATP synthesis"}, {"subject": "ATP hydrolysis", "relationship": "has therapeutic benefits in", "target": "disease models"}, {"subject": "ATP hydrolysis", "relationship": "is a significant concern in", "target": "mitochondrial and age-related diseases"}, {"subject": "Computational frameworks", "relationship": "have been instrumental in", "target": "analyzing and simulating mitochondrial ATP synthesis"}, {"subject": "Computational frameworks", "relationship": "employ thermodynamic and kinetic principles to model", "target": "the processes of the ETC, ATP synthase, and transporters for phosphate and adenine nucleotides"}, {"subject": "Computational frameworks", "relationship": "can simulate in vitro respirometry experiments and explain", "target": "cardiac respiratory control in vivo"}, {"subject": "Mitochondrial dynamics", "relationship": "such as fission", "target": "can influence, the translocation of ATP synthase to the plasma membrane (PM"}, {"subject": "Translocation of ATP synthase to the plasma membrane (PM)", "relationship": "involves the association of the ATP synthase complex with microtubules and its delivery to the cell surface", "target": "where it can potentially influence extracellular ATP (eATP"}, {"subject": "Mitochondrial dynamics", "relationship": "are critical for comprehending", "target": "the role of ATP synthase in various cellular contexts, including cancer"}, {"subject": "Mitochondrial morphology", "relationship": "affects", "target": "ATP production"}, {"subject": "Detailed mitochondrial models", "relationship": "investigate how specific morphologies", "target": "such as those found in synaptic mitochondria, influence ATP production capacity"}, {"subject": "Mitochondrial morphology", "relationship": "has minor effects on ATP production in equilibrium steady-state conditions", "target": "but can significantly impact energy buffering mechanisms in non-equilibrium, physiologically relevant conditions"}, {"subject": "ATP synthase/IF1 axis", "relationship": "has emerged as a potential therapeutic target for", "target": "cognitive deficits associated with neurodegenerative and age-associated pathologies"}, {"subject": "IF1", "relationship": "inhibits mitochondrial ATP synthase under physiological conditions", "target": "suggesting that modulation of this axis could influence, neuronal, synaptic, and cognitive functions"}, {"subject": "Synthetic environments", "relationship": "are being created and analyzed for", "target": "mitochondrial ATP production"}, {"subject": "Mitochondrial diseases", "relationship": "can be treated through", "target": "the manipulation of ATP synthase activity"}, {"subject": "Detailed analyses of mitochondrial morphology and dynamics", "relationship": "provide valuable insights into", "target": "the fundamental processes of ATP synthesis"}, {"subject": "Research", "relationship": "continues to unravel the complexities of", "target": "mitochondrial function"}, {"subject": "Research", "relationship": "reveals the potential for", "target": "novel therapeutic strategies and a deeper understanding of cellular energetics"}, {"subject": "ATP", "relationship": "is the primary energy currency of", "target": "the cell"}, {"subject": "Mitochondria", "relationship": "are referred to as", "target": "the powerhouses of the cell"}, {"subject": "Mitochondria", "relationship": "are the primary site for", "target": "ATP production"}, {"subject": "ATP synthesis", "relationship": "is a fundamental process for", "target": "life"}, {"subject": "Mitochondrial F1Fo-ATP synthase", "relationship": "synthesizes ATP using", "target": "a rotary mechanism"}, {"subject": "Proton gradient", "relationship": "powers the", "target": "rotary mechanism of ATP synthesis"}, {"subject": "Electron transport chain", "relationship": "produces the correct voltage for", "target": "ATP production"}, {"subject": "Selective inhibition of ATP hydrolysis", "relationship": "has therapeutic benefits in", "target": "disease models"}, {"subject": "ATP synthase", "relationship": "operating in reverse", "target": "is a concern in, mitochondrial and age-related diseases"}, {"subject": "Computational frameworks", "relationship": "are instrumental in", "target": "analyzing and simulating mitochondrial ATP synthesis"}, {"subject": "Computational frameworks", "relationship": "employ thermodynamic and kinetic principles", "target": "to model the processes of the ETC, ATP synthase, and transporters"}, {"subject": "Spatial and temporal dynamics of ATP synthase", "relationship": "influence the translocation of", "target": "ATP synthase to the plasma membrane"}, {"subject": "ATP synthase complex", "relationship": "associates with microtubules and is delivered to the cell surface", "target": "potentially influencing extracellular ATP levels"}, {"subject": "Mitochondrial dynamics", "relationship": "such as fission", "target": "influence the translocation of, ATP synthase to the plasma membrane"}, {"subject": "ATP synthase/IF1 axis", "relationship": "is a potential therapeutic target for", "target": "cognitive deficits associated with neurodegenerative and age-associated pathologies"}, {"subject": "Manipulating ATP synthase activity", "relationship": "offers promising avenues for", "target": "the treatment of mitochondrial diseases and the enhancement of cellular energy efficiency"}, {"subject": "Computational models and detailed analyses", "relationship": "provide valuable insights into", "target": "the fundamental processes of ATP synthesis"}, {"subject": "Mitochondrial function", "relationship": "unravels the complexities of", "target": "cellular energetics"}, {"subject": "Novel therapeutic strategies", "relationship": "and a deeper understanding of cellular energetics", "target": "become increasingly apparent"}, {"subject": "Adenosine triphosphate (ATP)", "relationship": "is the primary energy currency of", "target": "the cell"}, {"subject": "Mitochondria", "relationship": "are referred to as", "target": "the powerhouses of the cell"}, {"subject": "Mitochondria", "relationship": "are the primary site for", "target": "ATP production through oxidative phosphorylation (OXPHOS"}, {"subject": "ATP synthesis", "relationship": "is a fundamental process for", "target": "life"}, {"subject": "Mitochondrial F1Fo-ATP synthase", "relationship": "synthesizes ATP using", "target": "a rotary mechanism powered by the proton gradient across the mitochondrial inner membrane"}, {"subject": "Proton gradient", "relationship": "is established by", "target": "the electron transport chain (ETC"}, {"subject": "Electron transport chain (ETC)", "relationship": "accepts electrons from various sources to produce the correct voltage for", "target": "ATP production"}, {"subject": "Mitochondrial membrane potential (MMP)", "relationship": "is crucial for the function of", "target": "F1Fo ATP synthase"}, {"subject": "ATP hydrolysis", "relationship": "can be selectively inhibited without affecting", "target": "ATP synthesis"}, {"subject": "ATP hydrolysis", "relationship": "has therapeutic benefits in", "target": "disease models"}, {"subject": "ATP hydrolysis", "relationship": "is a significant concern in", "target": "mitochondrial and age-related diseases"}, {"subject": "Computational frameworks", "relationship": "have been instrumental in", "target": "analyzing and simulating mitochondrial ATP synthesis"}, {"subject": "Computational frameworks", "relationship": "employ thermodynamic and kinetic principles to model", "target": "the processes of the ETC, ATP synthase, and transporters for phosphate and adenine nucleotides"}, {"subject": "Computational frameworks", "relationship": "can simulate in vitro respirometry experiments and explain", "target": "cardiac respiratory control in vivo"}, {"subject": "Mitochondrial dynamics", "relationship": "such as fission", "target": "can influence, the translocation of ATP synthase to the plasma membrane (PM"}, {"subject": "Translocation of ATP synthase to the plasma membrane (PM)", "relationship": "involves the association of the ATP synthase complex with microtubules and its delivery to the cell surface", "target": "where it can potentially influence extracellular ATP (eATP"}, {"subject": "Mitochondrial dynamics", "relationship": "are critical for comprehending", "target": "the role of ATP synthase in various cellular contexts, including cancer"}, {"subject": "Mitochondrial morphology", "relationship": "affects", "target": "ATP production"}, {"subject": "Detailed mitochondrial models", "relationship": "investigate how specific morphologies", "target": "such as those found in synaptic mitochondria, influence ATP production capacity"}, {"subject": "Mitochondrial morphology", "relationship": "has minor effects on ATP production in equilibrium steady-state conditions", "target": "but can significantly impact energy buffering mechanisms in non-equilibrium, physiologically relevant conditions"}, {"subject": "ATP synthase/IF1 axis", "relationship": "has emerged as a potential therapeutic target for", "target": "cognitive deficits associated with neurodegenerative and age-associated pathologies"}, {"subject": "IF1", "relationship": "inhibits mitochondrial ATP synthase under physiological conditions", "target": "suggesting that modulation of this axis could influence, neuronal, synaptic, and cognitive functions"}, {"subject": "Synthetic environments", "relationship": "are being created and analyzed for", "target": "mitochondrial ATP production"}, {"subject": "Mitochondrial diseases", "relationship": "can be treated through", "target": "the manipulation of ATP synthase activity"}, {"subject": "Detailed analyses of mitochondrial morphology and dynamics", "relationship": "provide valuable insights into", "target": "the fundamental processes of ATP synthesis"}, {"subject": "Research", "relationship": "continues to unravel the complexities of", "target": "mitochondrial function"}, {"subject": "Research", "relationship": "reveals the potential for", "target": "novel therapeutic strategies and a deeper understanding of cellular energetics"}], "timestamp": "2024-01-10T20:28:35.950941"}, {"file_id": "76725ca31bcc4918b4b806f0493de4e9", "article": "Chunk # 1.\nThe role of IF1 in the regulation of mitochondrial ATP synthase https://journals.plos.org/plosbiology/article?id=10.1371/journal.pbio.3001252", "summary": "IF1 plays a crucial role in regulating mitochondrial ATP synthase. [source]", "clean_entities": [], "dirty_entities": ["Entities: IF1", "mitochondrial ATP synthase", "Keywords: regulation", "mitochondrial ATP synthase", "Key Phrases: role of IF1", "regulation of mitochondrial ATP synthase", "References: https://journals.plos.org/plosbiology/article?id=10.1371/journal.pbio.3001252", "Abstract Concepts: role", "regulation", "ATP production", "", "IF1 plays a crucial role in the regulation of mitochondrial ATP synthase", "according to a study published in PLOS Biology [1]. The study explores the specific mechanisms by which IF1 modulates the activity of mitochondrial ATP synthase", "which is responsible for ATP production in the mitochondria. The researchers highlight the importance of understanding this regulatory process for a better understanding of mitochondrial function and its implications in various cellular processes.", "", "[1] Link: https://journals.plos.org/plosbiology/article?id=10.1371/journal.pbio.3001252"], "references": {"urls": ["https://www.ncbi.nlm.nih.gov/pmc/articles/PMC10183815/", "https://dx.doi.org/10.2174/1381612819666131230124334", "https://beards-lab.github.io/QAMAS_book/", "https://www.nature.com/articles/s41598-019-54159-1", "https://doi.org/10.1038/s42003-023-04785-3", "https://journals.plos.org/plosbiology/article?id=10.1371/journal.pbio.3001252"], "references": "\n\n- Acin-Perez, R., et al. (2023). The mitochondrial F1Fo-ATP synthase uses a rotary mechanism to synthesise ATP. University College London, London, UK. https://www.ncbi.nlm.nih.gov/pmc/articles/PMC10183815/\n- Bagkos, G., Koufopoulos, K., & Piperi, C. (2014). ATP Synthesis Revisited: New Avenues for the Management of Mitochondrial Diseases. Current Pharmaceutical Design, 20(28). https://dx.doi.org/10.2174/1381612819666131230124334\n- Beard's Lab. (n.d.). A computational framework for analyzing and simulating mitochondrial ATP synthesis. https://beards-lab.github.io/QAMAS_book/\n- Brand, M. D., et al. (2020). Efficiency of ATP production differs by substrate and tissue. https://www.nature.com/articles/s41598-019-54159-1\n- Chang, Y. W., Tony Yang, T., Chen, M. C., et al. (2023). Spatial and temporal dynamics of ATP synthase from mitochondria toward the cell surface. Communications Biology, 6, 427. https://doi.org/10.1038/s42003-023-04785-3\n- PLOS Biology. (n.d.). The role of IF1 in the regulation of mitochondrial ATP synthase. https://journals.plos.org/plosbiology/article?id=10.1371/journal.pbio.3001252"}, "topics": [{"topic": "Mitochondrial ATP Synthase Regulation", "justification": "The summary explicitly mentions that IF1 plays a crucial role in regulating mitochondrial ATP synthase."}, {"topic": "IF1 Function", "justification": "The summary highlights the specific function of IF1 in regulating mitochondrial ATP synthase."}], "hypothetical_questions": [{"question_type": "Content-Based Question", "question": "How does IF1 regulate mitochondrial ATP synthase?"}, {"question_type": "Analytical Question", "question": "What would happen if there was a deficiency of IF1 in the regulation of mitochondrial ATP synthase?"}, {"question_type": "Creative/Scenario-Based Question", "question": "Imagine a scenario where IF1 is completely absent in the regulation of mitochondrial ATP synthase. How would this affect the energy production in the cell?"}, {"question_type": "Contextual/Relational Question", "question": "How does the regulation of mitochondrial ATP synthase by IF1 relate to other processes involved in cellular energy metabolism?"}, {"question_type": "User-Interactive Question", "question": "Can you think of any other molecules or proteins that might interact with IF1 in the regulation of mitochondrial ATP synthase?"}], "knowledge_triplets": [{"subject": "IF1", "relationship": "regulates", "target": "mitochondrial ATP synthase"}, {"subject": "IF1", "relationship": "plays a role in", "target": "the regulation of mitochondrial ATP synthase"}, {"subject": "IF1", "relationship": "regulates", "target": "mitochondrial ATP synthase"}, {"subject": "IF1", "relationship": "modulates activity of", "target": "mitochondrial ATP synthase"}, {"subject": "mitochondrial ATP synthase", "relationship": "responsible for", "target": "ATP production"}, {"subject": "regulatory process", "relationship": "important for", "target": "understanding mitochondrial function"}, {"subject": "regulatory process", "relationship": "important for", "target": "implications in cellular processes"}, {"subject": "IF1", "relationship": "regulates", "target": "mitochondrial ATP synthase"}, {"subject": "IF1", "relationship": "plays a role in", "target": "the regulation of mitochondrial ATP synthase"}, {"subject": "IF1", "relationship": "modulates activity of", "target": "mitochondrial ATP synthase"}, {"subject": "mitochondrial ATP synthase", "relationship": "responsible for", "target": "ATP production"}, {"subject": "regulatory process", "relationship": "important for", "target": "understanding mitochondrial function"}, {"subject": "regulatory process", "relationship": "important for", "target": "implications in cellular processes"}], "timestamp": "2024-01-10T20:28:51.212988"}]