[{"file_id": "bcf05b9d20cc4a4db92660c566570f0c", "article": "Chunk # 0.\n# Leveraging Wikidata APIs for Creative and Innovative Data Applications\n\n## Introduction\n\nIn the rapidly evolving landscape of data-driven technologies, the role of Application Programming Interfaces (APIs) has become increasingly significant APIs serve as the conduits through which different software components communicate, enabling the seamless integration and manipulation of data across various platforms Among the plethora of available APIs, those provided by Wikidata stand out due to their open nature and the vast repository of structured data they offer access to This report delves into how the use of Wikidata APIs can contribute to the development of creative and innovative data applications, thereby fostering a new wave of advancements in the field of data-driven technology \n## The Potential of Wikidata APIs\n\nWikidata, a free and open knowledge base, allows users to access a wealth of structured data about a myriad of topics The platform's APIs provide the means to programmatically interact with this data, which can be leveraged to create a diverse range of applications that are both innovative and creative \n### Data Accessibility and Integration\n\nOne of the primary advantages of Wikidata APIs is the facilitation of data accessibility and integration Developers can use these APIs to retrieve, update, and manipulate data from Wikidata, integrating it into their own applications with relative ease (Wikidata:Data access, n.d.) This capability is crucial for fostering innovation, as it allows for the combination of data from Wikidata with other data sources, creating enriched datasets that can drive more sophisticated analyses and insights \n### Enhancing Data Quality and Reuse\n\nWikidata's development plan emphasizes the importance of empowering the community to increase data quality and encouraging the reuse of data for increased impact (Wikidata:Development plan, n.d.) By providing APIs that enable feedback loops with data re-users, Wikidata not only improves the quality of its own data but also supports the development of applications that can contribute to this virtuous cycle of data enhancement and reuse \n### Knowledge Graphs and Contextual Understanding\n\nThe rise of knowledge graphs, as predicted by industry experts, points to a future where data is not only connected but also contextualized (VentureBeat, n.d.) Wikidata APIs can be instrumental in constructing these knowledge graphs, which can then be used to drive language models and AI solutions that require a deep understanding of relationships and context within data \n### Fostering Creativity in Application Development\n\nThe flexibility of Wikidata APIs has been demonstrated in user studies, where participants were able to create HTML-based applications that present data combining Wikidata and data from other sites in a matter of minutes (ACM Digital Library, n.d.) This ease of use lowers the barrier to entry for developers and encourages experimentation and creativity in application development \n## Case Studies and Applications\n\n### Wikxhibit: A Tool for Data Presentation\n\nWikxhibit is an example of an application that leverages Wikidata APIs to allow HTML authors to build applications that search Wikidata and display information about various entities, such as artists and their paintings (ACM Digital Library, n.d.) This tool demonstrates the potential for creating rich presentations that aggregate and link data from multiple API-backed websites without the need for additional programming \n### Cross-referenced APIs for Enhanced User Experience\n\nBy connecting Wikidata's linked data objects to objects on other websites, applications can offer users a more comprehensive experience For instance, an artist page could combine data from Wikidata, Spotify, YouTube, and Songkick, providing users with a holistic view of the artist's work and upcoming events (ACM Digital Library, n.d.) \n### Real-time AI and Cost Savings\n\nThe integration of real-time AI with data from Wikidata APIs can lead to significant cost savings for enterprises By automating the extraction of actionable insights from complex documents, companies can reduce the need for extensive staffing, thus enhancing competitive value from data (VentureBeat, n.d.) \n## Challenges and Considerations\n\nWhile the potential for innovation with Wikidata APIs is vast, there are challenges and considerations that must be addressed Ensuring data privacy and security during data sharing and collaboration is paramount Additionally, the need for high-quality data is more pronounced than ever, as generative AI and foundation models become more prevalent in enterprise workflows (VentureBeat, n.d.) \n## Conclusion\n\nThe use of Wikidata APIs stands at the forefront of fostering creativity and innovation in data-driven applications By providing accessible, high-quality data and the tools to integrate and contextualize this data, Wikidata APIs enable developers to create applications that are not only innovative but also deeply rooted in the rich context of interconnected knowledge As we move into 2024, the continued evolution of these APIs and the applications they empower will undoubtedly shape the future of data-driven technology \n## References\n\n- ACM Digital Library (n.d.) Retrieved January 4, 2024, from https://dl.acm.org/doi/fullHtml/10.1145/3526113.3545706\n- VentureBeat (n.d.) 11 data predictions for AI-centric enterprise growth in 2024", "summary": "Wikidata APIs offer a gateway to a vast repository of structured data, enabling the development of creative and innovative data applications. These APIs facilitate data accessibility, integration, and quality enhancement, while also supporting the construction of knowledge graphs for contextual understanding. They foster creativity in application development and have been utilized in tools like Wikxhibit for data presentation. By connecting with other APIs, Wikidata enhances the user experience and enables real-time AI integration, leading to cost savings. However, challenges remain in ensuring data privacy, security, and maintaining high-quality data. Overall, Wikidata APIs are pivotal in shaping the future of data-driven technology.", "clean_entities": [], "dirty_entities": ["Entities: Wikidata APIs", "APIs", "Wikidata", "data-driven technologies", "software components", "platforms", "structured data", "repository", "data applications", "advancements", "data-driven technology", "data accessibility", "integration", "developers", "data sources", "datasets", "analyses", "insights", "data quality", "data re-users", "knowledge graphs", "contextual understanding", "language models", "AI solutions", "application development", "HTML-based applications", "user studies", "Wikxhibit", "HTML authors", "artists", "paintings", "linked data objects", "user experience", "Spotify", "YouTube", "Songkick", "real-time AI", "cost savings", "enterprises", "automation", "actionable insights", "complex documents", "companies", "data privacy", "security", "data sharing", "collaboration", "high-quality data", "generative AI", "foundation models", "data-driven applications", "interconnected knowledge", "future", "references.", "", "Keywords: Wikidata APIs", "data applications", "structured data", "data accessibility", "integration", "developers", "data sources", "datasets", "data quality", "data re-users", "knowledge graphs", "contextual understanding", "language models", "AI solutions", "application development", "HTML-based applications", "user studies", "Wikxhibit", "artists", "paintings", "linked data objects", "user experience", "real-time AI", "cost savings", "automation", "actionable insights", "data privacy", "security", "collaboration", "high-quality data", "generative AI", "foundation models", "interconnected knowledge.", "", "Key Phrases: Wikidata APIs", "data-driven technologies", "software components", "structured data", "data accessibility", "integration", "innovative data applications", "advancements in the field of data-driven technology", "data sources", "enriched datasets", "sophisticated analyses and insights", "data quality", "reuse of data", "feedback loops with data re-users", "knowledge graphs", "contextualized data", "language models", "AI solutions", "experimentation and creativity in application development", "HTML-based applications", "data from multiple API-backed websites", "comprehensive experience", "real-time AI", "cost savings for enterprises", "extraction of actionable insights", "high-quality data", "generative AI", "foundation models", "data-driven applications", "interconnected knowledge", "future of data-driven technology.", "", "References: ACM Digital Library", "VentureBeat."], "references": {"urls": ["https://dl.acm.org/doi/fullHtml/10.1145/3526113.3545706", "https://venturebeat.com/data-infrastructure/11-data-predictions-for-ai-centric-enterprise-growth-in-2024/", "https://www.wikidata.org/wiki/Wikidata:Data_access", "https://www.wikidata.org/wiki/Wikidata:Development_plan"], "references": "\n\n- ACM Digital Library. (n.d.). Retrieved January 4, 2024, from https://dl.acm.org/doi/fullHtml/10.1145/3526113.3545706\n- VentureBeat. (n.d.). 11 data predictions for AI-centric enterprise growth in 2024. Retrieved January 4, 2024, from https://venturebeat.com/data-infrastructure/11-data-predictions-for-ai-centric-enterprise-growth-in-2024/\n- Wikidata:Data access. (n.d.). Retrieved January 4, 2024, from https://www.wikidata.org/wiki/Wikidata:Data_access\n- Wikidata:Development plan. (n.d.). Retrieved January 4, 2024, from https://www.wikidata.org/wiki/Wikidata:Development_plan"}, "topics": [{"topic": "Wikidata APIs", "justification": "The main focus of the summary is on the Wikidata APIs and their capabilities."}, {"topic": "Data accessibility and integration", "justification": "The summary mentions that the Wikidata APIs facilitate data accessibility and integration."}, {"topic": "Quality enhancement and knowledge graphs", "justification": "The summary states that the Wikidata APIs support quality enhancement and the construction of knowledge graphs."}, {"topic": "Creative and innovative data applications", "justification": "The summary highlights that the Wikidata APIs enable the development of creative and innovative data applications."}, {"topic": "Tools like Wikxhibit for data presentation", "justification": "The summary mentions the use of the Wikidata APIs in tools like Wikxhibit for data presentation."}, {"topic": "Real-time AI integration and cost savings", "justification": "The summary states that by connecting with other APIs, Wikidata enhances the user experience and enables real-time AI integration, leading to cost savings."}, {"topic": "Challenges in data privacy, security, and data quality", "justification": "The summary acknowledges that challenges remain in ensuring data privacy, security, and maintaining high-quality data."}, {"topic": "Future of data-driven technology", "justification": "The summary concludes by stating that Wikidata APIs are pivotal in shaping the future of data-driven technology."}], "hypothetical_questions": [{"question_type": "Content-Based Question", "question": "How can the use of Wikidata APIs enhance data accessibility, integration, and quality enhancement in data applications?"}, {"question_type": "Analytical Question", "question": "What are the potential benefits of constructing knowledge graphs using Wikidata APIs for contextual understanding?"}, {"question_type": "Creative/Scenario-Based Question", "question": "Imagine you are developing a new data application. How could you leverage Wikidata APIs to foster creativity and innovation in your application?"}, {"question_type": "Contextual/Relational Question", "question": "How can connecting Wikidata APIs with other APIs enhance the user experience and enable real-time AI integration, leading to cost savings?"}, {"question_type": "User-Interactive Question", "question": "How might the challenges of data privacy, security, and maintaining high-quality data be addressed when utilizing Wikidata APIs in data-driven technology?"}], "knowledge_triplets": [{"subject": "APIs", "relationship": "retrieve", "target": "update, and manipulate data from Wikidata"}, {"subject": "artist page", "relationship": "combine data from Wikidata", "target": "Spotify, YouTube, and Songkick"}, {"subject": "Wikidata APIs", "relationship": "enable", "target": "developers"}, {"subject": "Wikidata APIs", "relationship": "contribute to", "target": "development of creative and innovative data applications"}, {"subject": "Wikidata APIs", "relationship": "facilitate", "target": "data accessibility and integration"}, {"subject": "Wikidata APIs", "relationship": "retrieve", "target": "update, and manipulate, data from Wikidata"}, {"subject": "Wikidata APIs", "relationship": "combine", "target": "data from Wikidata with other data sources"}, {"subject": "Wikidata APIs", "relationship": "drive", "target": "more sophisticated analyses and insights"}, {"subject": "Wikidata APIs", "relationship": "increase", "target": "data quality"}, {"subject": "Wikidata APIs", "relationship": "encourage", "target": "reuse of data"}, {"subject": "Wikidata APIs", "relationship": "construct", "target": "knowledge graphs"}, {"subject": "Wikidata APIs", "relationship": "drive", "target": "language models and AI solutions"}, {"subject": "Wikidata APIs", "relationship": "lower", "target": "barrier to entry for developers"}, {"subject": "Wikxhibit", "relationship": "leverages", "target": "Wikidata APIs"}, {"subject": "Wikxhibit", "relationship": "search", "target": "Wikidata and display information about various entities"}, {"subject": "Cross-referenced APIs", "relationship": "connect", "target": "Wikidata's linked data objects to objects on other websites"}, {"subject": "Cross-referenced APIs", "relationship": "offer", "target": "users a more comprehensive experience"}, {"subject": "Real-time AI", "relationship": "integrate", "target": "data from Wikidata APIs"}, {"subject": "Real-time AI", "relationship": "lead to", "target": "significant cost savings for enterprises"}, {"subject": "Real-time AI", "relationship": "automate", "target": "extraction of actionable insights from complex documents"}, {"subject": "Challenges and Considerations", "relationship": "address", "target": "data privacy and security during data sharing and collaboration"}, {"subject": "Challenges and Considerations", "relationship": "address", "target": "need for high-quality data"}, {"subject": "Wikidata APIs", "relationship": "enable", "target": "developers to create applications that are innovative and deeply rooted in the rich context of interconnected knowledge"}, {"subject": "Wikidata APIs", "relationship": "shape", "target": "future of data-driven technology"}, {"subject": "APIs", "relationship": "enable", "target": "developers"}, {"subject": "Wikidata", "relationship": "offers access to", "target": "structured data"}, {"subject": "Wikidata APIs", "relationship": "contribute to", "target": "development of creative and innovative data applications"}, {"subject": "Wikidata", "relationship": "allows users to access", "target": "structured data"}, {"subject": "Wikidata APIs", "relationship": "can be leveraged to create", "target": "diverse range of applications"}, {"subject": "Wikidata APIs", "relationship": "facilitate", "target": "data accessibility and integration"}, {"subject": "APIs", "relationship": "retrieve", "target": "update, and manipulate, data from Wikidata"}, {"subject": "Wikidata APIs", "relationship": "instrumental in constructing", "target": "knowledge graphs"}, {"subject": "knowledge graphs", "relationship": "drive", "target": "language models and AI solutions"}, {"subject": "participants", "relationship": "create", "target": "HTML-based applications"}, {"subject": "Wikxhibit", "relationship": "leverages", "target": "Wikidata APIs"}, {"subject": "Wikxhibit", "relationship": "search", "target": "Wikidata and display information about various entities"}, {"subject": "Cross-referenced APIs", "relationship": "connect", "target": "Wikidata's linked data objects to objects on other websites"}, {"subject": "Cross-referenced APIs", "relationship": "offer", "target": "users a more comprehensive experience"}, {"subject": "Real-time AI", "relationship": "integrate", "target": "data from Wikidata APIs"}, {"subject": "Real-time AI", "relationship": "lead to", "target": "significant cost savings for enterprises"}, {"subject": "Real-time AI", "relationship": "automate", "target": "extraction of actionable insights from complex documents"}, {"subject": "Challenges and Considerations", "relationship": "address", "target": "data privacy and security during data sharing and collaboration"}, {"subject": "Challenges and Considerations", "relationship": "address", "target": "need for high-quality data"}, {"subject": "Wikidata APIs", "relationship": "enable", "target": "developers to create applications that are innovative and deeply rooted in the rich context of interconnected knowledge"}, {"subject": "Wikidata APIs", "relationship": "shape", "target": "future of data-driven technology"}], "timestamp": "2024-01-10T21:17:08.710052"}, {"file_id": "bcf05b9d20cc4a4db92660c566570f0c", "article": "Chunk # 1.\nRetrieved January 4, 2024, from https://venturebeat.com/data-infrastructure/11-data-predictions-for-ai-centric-enterprise-growth-in-2024/\n- Wikidata:Data access (n.d.) Retrieved January 4, 2024, from https://www.wikidata.org/wiki/Wikidata:Data_access\n- Wikidata:Development plan (n.d.) Retrieved January 4, 2024, from https://www.wikidata.org/wiki/Wikidata:Development_plan", "summary": "Revised Summary: AI-centric enterprise growth in 2024 is predicted to be driven by 11 key data trends, according to a VentureBeat article. Efficient data infrastructure and access are crucial for the success of AI-centric enterprises. The development plan outlined in the Wikidata page on \"Development plan\" provides essential guidance for achieving AI-centric enterprise growth. The VentureBeat article offers 11 predictions for data-driven growth in AI-centric enterprises in 2024. Additionally, the Wikidata page titled \"Data access\" provides information on accessing data, while the Wikidata page titled \"Development plan\" offers insights into the plan for AI-centric enterprise growth. Overall, data predictions, infrastructure, access, and development plans are all essential components of AI-centric enterprise growth.", "clean_entities": ["\"11 data predictions for AI-centric enterprise growth in 2024\"", "\"data infrastructure\"", "\"data access\"", "\"development plan\"", "VentureBeat article: \"11 data predictions for AI-centric enterprise growth in 2024\" retrieved from https://venturebeat.com/data-infrastructure/11-data-predictions-for-ai-centric-enterprise-growth-in-2024/", "Wikidata page: \"Data access\" retrieved from https://www.wikidata.org/wiki/Wikidata:Data_access", "Wikidata page: \"Development plan\" retrieved from https://www.wikidata.org/wiki/Wikidata:Development_plan", "Data predictions", "AI-centric enterprise growth", "Data infrastructure", "Data access", "Development plan"], "dirty_entities": ["Entities: VentureBeat", "Wikidata", "", "Keywords: data predictions", "AI-centric enterprise growth", "data infrastructure", "data access", "development plan", "", "Key Phrases:", "", "References:", "", "Abstract Concepts:", "", "Output: VentureBeat", "Wikidata", "data predictions", "AI-centric enterprise growth", "data infrastructure", "data access", "development plan", "\"11 data predictions for AI-centric enterprise growth in 2024\"", "\"data infrastructure\"", "\"data access\"", "\"development plan\""], "references": {"urls": ["https://dl.acm.org/doi/fullHtml/10.1145/3526113.3545706", "https://venturebeat.com/data-infrastructure/11-data-predictions-for-ai-centric-enterprise-growth-in-2024/", "https://www.wikidata.org/wiki/Wikidata:Data_access", "https://www.wikidata.org/wiki/Wikidata:Development_plan"], "references": "\n\n- ACM Digital Library. (n.d.). Retrieved January 4, 2024, from https://dl.acm.org/doi/fullHtml/10.1145/3526113.3545706\n- VentureBeat. (n.d.). 11 data predictions for AI-centric enterprise growth in 2024. Retrieved January 4, 2024, from https://venturebeat.com/data-infrastructure/11-data-predictions-for-ai-centric-enterprise-growth-in-2024/\n- Wikidata:Data access. (n.d.). Retrieved January 4, 2024, from https://www.wikidata.org/wiki/Wikidata:Data_access\n- Wikidata:Development plan. (n.d.). Retrieved January 4, 2024, from https://www.wikidata.org/wiki/Wikidata:Development_plan"}, "topics": [{"topic": "AI-centric enterprise growth in 2024", "justification": "The summary mentions that AI-centric enterprise growth in 2024 is predicted to be driven by 11 key data trends."}, {"topic": "11 key data trends for AI-centric enterprise growth in 2024", "justification": "The summary states that there are 11 predictions for data-driven growth in AI-centric enterprises in 2024."}, {"topic": "Efficient data infrastructure for AI-centric enterprises", "justification": "The summary highlights that efficient data infrastructure is crucial for the success of AI-centric enterprises."}, {"topic": "Accessing data for AI-centric enterprises", "justification": "The summary mentions that access to data is essential for the success of AI-centric enterprises."}, {"topic": "Development plan for AI-centric enterprise growth", "justification": "The summary refers to a Wikidata page that provides essential guidance for achieving AI-centric enterprise growth."}, {"topic": "Insights from the Wikidata page on \"Development plan\"", "justification": "The summary mentions that the Wikidata page titled \"Development plan\" offers insights into the plan for AI-centric enterprise growth."}, {"topic": "Information on data access from the Wikidata page titled \"Data access\"", "justification": "The summary states that the Wikidata page titled \"Data access\" provides information on accessing data."}, {"topic": "Components of AI-centric enterprise growth", "justification": "The summary concludes by stating that data predictions, infrastructure, access, and development plans are all essential components of AI-centric enterprise growth."}], "hypothetical_questions": [{"question_type": "Content-Based Question", "question": "How important is efficient data infrastructure and access for the success of AI-centric enterprises?"}, {"question_type": "Analytical Question", "question": "How can the development plan outlined in the Wikidata page on \"Development plan\" contribute to achieving AI-centric enterprise growth?"}, {"question_type": "Creative/Scenario-Based Question", "question": "Imagine a scenario where an AI-centric enterprise lacks efficient data infrastructure and access. How would this impact its growth and success?"}, {"question_type": "Contextual/Relational Question", "question": "How do the predictions for data-driven growth in AI-centric enterprises in 2024, mentioned in the VentureBeat article, relate to the development plan outlined in the Wikidata page on \"Development plan\"?"}, {"question_type": "User-Interactive Question", "question": "In your opinion, what are some potential challenges that AI-centric enterprises may face in terms of data infrastructure and access, and how can they overcome them?"}], "knowledge_triplets": [{"subject": "\"11 data predictions for AI-centric enterprise growth in 2024\"", "relationship": "\"is about\"", "target": "\"Data predictions\""}, {"subject": "\"11 data predictions for AI-centric enterprise growth in 2024\"", "relationship": "\"is about\"", "target": "\"AI-centric enterprise growth\""}, {"subject": "\"11 data predictions for AI-centric enterprise growth in 2024\"", "relationship": "\"is about\"", "target": "\"Data infrastructure\""}, {"subject": "\"11 data predictions for AI-centric enterprise growth in 2024\"", "relationship": "\"is retrieved from\"", "target": "\"VentureBeat article: '11 data predictions for AI-centric enterprise growth in 2024' retrieved from https://venturebeat.com/data-infrastructure/11-data-predictions-for-ai-centric-enterprise-growth-in-2024/\""}, {"subject": "\"Data infrastructure\"", "relationship": "\"is about\"", "target": "\"Data access\""}, {"subject": "\"Data access\"", "relationship": "\"is retrieved from\"", "target": "\"Wikidata page: 'Data access' retrieved from https://www.wikidata.org/wiki/Wikidata:Data_access\""}, {"subject": "\"Data infrastructure\"", "relationship": "\"is about\"", "target": "\"Development plan\""}, {"subject": "\"Development plan\"", "relationship": "\"is retrieved from\"", "target": "\"Wikidata page: 'Development plan' retrieved from https://www.wikidata.org/wiki/Wikidata:Development_plan\""}, {"subject": "VentureBeat", "relationship": "mentions", "target": "data predictions"}, {"subject": "VentureBeat", "relationship": "mentions", "target": "AI-centric enterprise growth"}, {"subject": "VentureBeat", "relationship": "mentions", "target": "data infrastructure"}, {"subject": "VentureBeat", "relationship": "mentions", "target": "development plan"}, {"subject": "Wikidata", "relationship": "provides", "target": "data access"}, {"subject": "Wikidata", "relationship": "provides", "target": "development plan"}, {"subject": "\"11 data predictions for AI-centric enterprise growth in 2024\"", "relationship": "\"is about\"", "target": "\"Data predictions\""}, {"subject": "\"11 data predictions for AI-centric enterprise growth in 2024\"", "relationship": "\"is about\"", "target": "\"AI-centric enterprise growth\""}, {"subject": "\"11 data predictions for AI-centric enterprise growth in 2024\"", "relationship": "\"is about\"", "target": "\"Data infrastructure\""}, {"subject": "\"11 data predictions for AI-centric enterprise growth in 2024\"", "relationship": "\"is retrieved from\"", "target": "\"VentureBeat article: '11 data predictions for AI-centric enterprise growth in 2024' retrieved from https://venturebeat.com/data-infrastructure/11-data-predictions-for-ai-centric-enterprise-growth-in-2024/\""}, {"subject": "\"Data infrastructure\"", "relationship": "\"is about\"", "target": "\"Data access\""}, {"subject": "\"Data access\"", "relationship": "\"is retrieved from\"", "target": "\"Wikidata page: 'Data access' retrieved from https://www.wikidata.org/wiki/Wikidata:Data_access\""}, {"subject": "\"Data infrastructure\"", "relationship": "\"is about\"", "target": "\"Development plan\""}, {"subject": "\"Development plan\"", "relationship": "\"is retrieved from\"", "target": "\"Wikidata page: 'Development plan' retrieved from https://www.wikidata.org/wiki/Wikidata:Development_plan\""}, {"subject": "VentureBeat", "relationship": "\"mentions\"", "target": "\"Data predictions\""}, {"subject": "VentureBeat", "relationship": "\"mentions\"", "target": "\"AI-centric enterprise growth\""}, {"subject": "VentureBeat", "relationship": "\"mentions\"", "target": "\"Data infrastructure\""}, {"subject": "VentureBeat", "relationship": "\"mentions\"", "target": "\"Development plan\""}, {"subject": "Wikidata", "relationship": "\"provides\"", "target": "\"Data access\""}, {"subject": "Wikidata", "relationship": "\"provides\"", "target": "\"Development plan\""}], "timestamp": "2024-01-10T21:17:57.830214"}]