[{"file_id": "4706f52883e444c5a2a5fc86eff1b078", "article": "Chunk # 0.\n# Analyzing the Structure of Academic Papers in Chemistry\n\nAcademic papers in chemistry, as in other scientific disciplines, adhere to a structured format that facilitates the dissemination and comprehension of research findings This report delves into the common sections and methodologies of chemistry papers, as well as the presentation of data, drawing from a variety of sources including journal guidelines, conference announcements, and academic articles \n## Introduction\n\nChemistry, often referred to as the central science, is a field that encompasses the study of matter's composition, structure, properties, and the changes it undergoes during chemical reactions (Nature Portfolio, n.d.) Academic papers in chemistry serve as a medium for researchers to report their findings, discuss their significance, and contribute to the collective knowledge of the scientific community The structure of these papers is designed to present complex information in an organized and standardized manner, which is crucial for peer review, reproducibility, and further research \n## Common Sections of Chemistry Papers\n\n### Title and Abstract\n\nThe title of a chemistry paper is a critical element as it provides the first impression of the research topic It should be concise yet informative, accurately reflecting the content of the paper The abstract follows the title and serves as a summary of the research, including the purpose, methodology, results, and conclusions It allows readers to quickly ascertain the paper's relevance to their interests \n### Introduction\n\nThe introduction sets the stage for the research by providing background information, stating the research question, and justifying the study's importance It often includes a literature review that situates the current research within the context of existing knowledge (LibreTexts, n.d.) \n### Experimental Section or Methodology\n\nThis section details the procedures and materials used in the research, allowing other scientists to replicate the study if desired It includes descriptions of the experimental setup, chemicals, and instruments, as well as the protocols followed during the research (LibreTexts, n.d.) \n### Results\n\nThe results section presents the data collected during the research without interpretation It often includes figures, tables, and graphs to visually convey the findings The data should be presented clearly and logically, often in the same sequence as the methods described in the previous section \n### Discussion\n\nIn the discussion section, the researchers interpret their results, explaining how the findings contribute to the field's understanding of the topic This section may also address the study's limitations and suggest areas for future research \n### Conclusion\n\nThe conclusion summarizes the main findings and their implications, reinforcing the significance of the research It may also reiterate the potential applications of the study's results \n### References\n\nA list of references cites all the sources used in the paper, including articles, books, and other materials This section is crucial for acknowledging the work of others and providing readers with resources for further reading \n## Methodologies in Chemistry Papers\n\nChemistry papers employ various methodologies depending on the research focus For example, experimental papers might describe laboratory procedures, while theoretical papers might focus on computational models or simulations Methodologies are chosen based on their suitability to answer the research question and their ability to provide reliable and valid results \n## Presentation of Data\n\nData presentation in chemistry papers is a meticulous process Researchers use figures, tables, and graphs to present their data effectively The choice of presentation style depends on the nature of the data and the best way to communicate the findings to the reader For instance, spectroscopic data might be best represented by a graph, while crystallographic data might require a table or a structural diagram \n## Analysis of Specific Chemistry Papers\n\n### Quantum Dots and Quantum Dot Assemblies\n\nIn the context of the ACS Spring 2024 meeting, one symposium focuses on the design of quantum dots for energy applications Papers in this area would likely include detailed methodologies on the synthesis of quantum dots, characterization techniques such as photoluminescence spectroscopy, and data on their energy conversion efficiencies (American Chemical Society, 2023) \n### Protein Structure Prediction\n\nA paper from the Institute of Physics, Chinese Academy of Sciences, combines structure prediction, molecular replacement, and direct-methods-aided model completion to solve protein structures This paper would include computational methods, data on predicted structures, and comparisons with experimentally determined structures (International Union of Crystallography, 2024) \n### Molecular Polaritons\n\nResearch on molecular polaritons would involve both experimental and theoretical methods to determine and predict their properties Data presentation might include spectroscopic evidence of polariton formation and theoretical models predicting their behavior (American Chemical Society, 2023) \n## Conclusion\n\nThe structure of academic papers in chemistry is designed to provide a clear and systematic presentation of research From the introduction to the conclusion, each section has a specific purpose that contributes to the overall narrative of the research", "summary": "Revised Summary (Iteration 3): **Analyzing Academic Papers in Chemistry: Essential for Advancing Scientific Knowledge**\n\nAcademic papers in chemistry play a vital role in advancing scientific knowledge and understanding. They adhere to a structured format that facilitates the dissemination and comprehension of research findings. Chemistry encompasses the study of matter's composition, properties, and chemical reactions. Researchers report their findings, discuss their significance, and contribute to the collective knowledge of the scientific community through these papers. The structure of these papers is designed to present complex information in an organized and standardized manner, ensuring clarity, peer review, reproducibility, and further research. Common sections in chemistry papers include the title and abstract, introduction, experimental methodology, results, discussion, conclusion, and references. Methodologies vary based on the research focus, employing laboratory procedures, computational models, or simulations. Data presentation relies on figures, tables, and graphs to effectively communicate findings. Specific chemistry papers may explore topics such as quantum dots, protein structure prediction, and molecular polaritons. Quantum dots, for example, have energy applications and require synthesis and characterization techniques like photoluminescence spectroscopy. Protein structure prediction employs computational methods, including molecular replacement and direct-methods-aided model completion. Experimental and theoretical methods provide spectroscopic evidence and theoretical models to understand molecular polaritons. By analyzing the structure and content of academic papers in chemistry, researchers contribute to the advancement of the field and the collective understanding of matter and its properties. Academic articles are a medium for researchers to report their findings, discuss their significance, and contribute to the scientific community. Journal guidelines and conference announcements provide structure and guidance. The composition of these articles typically includes a title, abstract, methodology, results, discussion, conclusion, and references. Computational models and simulations are used to study properties, chemical reactions, and energy applications. Tables and graphs effectively present data. Synthesis and characterization techniques play a crucial role in energy conversion efficiencies. The Institute of Physics is a prominent organization in the field. Structure prediction, molecular replacement, and direct-methods-aided model completion are computational methods used to determine protein structures. Experimental methods are also employed to validate theoretical models. The structure of academic papers often follows a standard format, including common sections such as the title and abstract, introduction, experimental section or methodology, results section, discussion section, conclusion section, and references section. Various organizations, such as Nature Portfolio, LibreTexts, the American Chemical Society, and the International Union of Crystallography, contribute to the dissemination of scientific knowledge in the field of chemistry. Analysis of specific chemistry papers, such as those on quantum dots and quantum dot assemblies, can provide further insights into the research landscape.", "clean_entities": ["Chemistry", "Scientific disciplines", "Academic papers", "Researchers", "Research findings", "Scientific community", "Journal guidelines", "Conference announcements", "Academic articles", "Matter", "Composition", "Structure", "Properties", "Chemical reactions", "Peer review", "Reproducibility", "Title", "Abstract", "Methodology", "Results", "Discussion", "Conclusion", "References", "Laboratory procedures", "Computational models", "Simulations", "Data presentation", "Figures", "Tables", "Graphs", "Quantum dots", "Energy applications", "Synthesis", "Characterization techniques", "Photoluminescence spectroscopy", "Energy conversion efficiencies", "Protein structure prediction", "Institute of Physics", "Structure prediction", "Molecular replacement", "Direct-methods-aided model completion", "Protein structures", "Computational methods", "Predicted structures", "Experimentally determined structures", "Molecular polaritons", "Experimental methods", "Theoretical methods", "Spectroscopic evidence", "Theoretical models", "Academic papers", "Chemistry", "Structure", "Research findings", "Scientific community", "Title", "Abstract", "Introduction", "Experimental Section", "Methodology", "Results", "Discussion", "Conclusion", "References", "Methodologies", "Data presentation", "Quantum dots", "Energy applications", "Synthesis", "Characterization techniques", "Protein structure prediction", "Structure prediction", "Molecular replacement", "Direct-methods-aided model completion", "Molecular polaritons", "Spectroscopic evidence", "Academic papers in chemistry", "Structure of academic papers", "Common sections of chemistry papers", "Title and abstract", "Introduction", "Experimental section or methodology", "Results section", "Discussion section", "Conclusion section", "References section", "Methodologies in chemistry papers", "Presentation of data", "Analysis of specific chemistry papers", "Quantum dots and quantum dot assemblies", "Protein structure prediction", "Molecular polaritons", "Nature Portfolio", "LibreTexts", "American Chemical Society", "International Union of Crystallography"], "dirty_entities": ["Entities:", "Chinese Academy of Sciences", "", "Keywords:", "", "Key Phrases:", "", "References:"], "references": {"urls": ["http://phys-acs.org/event/acs-spring-2024-many-flavors-of-chemistry/", "https://journals.iucr.org/m/issues/2024/02/00/lz5066/index.html", "https://human.libretexts.org/Bookshelves/Composition/Advanced_Composition/How_Arguments_Work_-_A_Guide_to_Writing_and_Analyzing_Texts_in_College_(Mills)/06:_The_Research_Process/6.06:_Getting_Familiar_with_Academic_Journal_Articles", "https://www.nature.com/subjects/chemistry"], "references": "\n\nA list of references cites all the sources used in the paper, including articles, books, and other materials. This section is crucial for acknowledging the work of others and providing readers with resources for further reading.\n\n## Methodologies in Chemistry Papers\n\nChemistry papers employ various methodologies depending on the research focus. For example, experimental papers might describe laboratory procedures, while theoretical papers might focus on computational models or simulations. Methodologies are chosen based on their suitability to answer the research question and their ability to provide reliable and valid results.\n\n## Presentation of Data\n\nData presentation in chemistry papers is a meticulous process. Researchers use figures, tables, and graphs to present their data effectively. The choice of presentation style depends on the nature of the data and the best way to communicate the findings to the reader. For instance, spectroscopic data might be best represented by a graph, while crystallographic data might require a table or a structural diagram.\n\n## Analysis of Specific Chemistry Papers\n\n### Quantum Dots and Quantum Dot Assemblies\n\nIn the context of the ACS Spring 2024 meeting, one symposium focuses on the design of quantum dots for energy applications. Papers in this area would likely include detailed methodologies on the synthesis of quantum dots, characterization techniques such as photoluminescence spectroscopy, and data on their energy conversion efficiencies (American Chemical Society, 2023).\n\n### Protein Structure Prediction\n\nA paper from the Institute of Physics, Chinese Academy of Sciences, combines structure prediction, molecular replacement, and direct-methods-aided model completion to solve protein structures. This paper would include computational methods, data on predicted structures, and comparisons with experimentally determined structures (International Union of Crystallography, 2024).\n\n### Molecular Polaritons\n\nResearch on molecular polaritons would involve both experimental and theoretical methods to determine and predict their properties. Data presentation might include spectroscopic evidence of polariton formation and theoretical models predicting their behavior (American Chemical Society, 2023).\n\n## Conclusion\n\nThe structure of academic papers in chemistry is designed to provide a clear and systematic presentation of research. From the introduction to the conclusion, each section has a specific purpose that contributes to the overall narrative of the research. Methodologies must be robust and appropriate for the research question, and data must be presented in a way that is both accessible and informative. As the field of chemistry continues to evolve, so too will the ways in which researchers communicate their findings, ensuring that the scientific community remains at the forefront of discovery and innovation.\n\n\n\nAmerican Chemical Society. (2023). ACS Spring 2024: Many Flavors of Chemistry. Retrieved from http://phys-acs.org/event/acs-spring-2024-many-flavors-of-chemistry/\n\nInternational Union of Crystallography. (2024). Solving protein structures by combining structure prediction, molecular replacement and direct-methods-aided model completion. Retrieved from https://journals.iucr.org/m/issues/2024/02/00/lz5066/index.html\n\nLibreTexts. (n.d.). Getting Familiar with Academic Journal Articles. Retrieved from https://human.libretexts.org/Bookshelves/Composition/Advanced_Composition/How_Arguments_Work_-_A_Guide_to_Writing_and_Analyzing_Texts_in_College_(Mills)/06:_The_Research_Process/6.06:_Getting_Familiar_with_Academic_Journal_Articles\n\nNature Portfolio. (n.d.). Chemistry. Retrieved from https://www.nature.com/subjects/chemistry"}, "topics": [{"topic": "Structure and Format of Academic Papers in Chemistry", "justification": "The summary highlights the structured format of academic papers in chemistry, including the common sections and their purpose."}, {"topic": "Role of Academic Papers in Advancing Scientific Knowledge", "justification": "The summary emphasizes the importance of academic papers in chemistry for advancing scientific knowledge and understanding."}, {"topic": "Study of Matter's Composition, Properties, and Chemical Reactions in Chemistry", "justification": "The summary mentions that chemistry encompasses the study of matter's composition, properties, and chemical reactions."}, {"topic": "Methodologies and Techniques in Chemistry Research", "justification": "The summary discusses the different methodologies and techniques used in chemistry research, including laboratory procedures, computational models, and simulations."}, {"topic": "Data Presentation in Chemistry Papers", "justification": "The summary highlights the use of figures, tables, and graphs to effectively communicate findings in chemistry papers."}, {"topic": "Specific Topics in Chemistry Papers (Quantum Dots, Protein Structure Prediction, Molecular Polaritons)", "justification": "The summary mentions specific topics that can be explored in chemistry papers, such as quantum dots, protein structure prediction, and molecular polaritons."}, {"topic": "Synthesis and Characterization Techniques in Chemistry Research", "justification": "The summary mentions the importance of synthesis and characterization techniques in chemistry research, particularly in energy conversion efficiencies."}, {"topic": "Prominent Organizations in the Field of Chemistry", "justification": "The summary mentions prominent organizations in the field of chemistry, such as the Institute of Physics, Nature Portfolio, LibreTexts, the American Chemical Society, and the International Union of Crystallography."}, {"topic": "Computational Methods in Chemistry Research", "justification": "The summary mentions computational methods used in chemistry research, such as molecular replacement, direct-methods-aided model completion, and simulations."}, {"topic": "Validation of Theoretical Models in Chemistry Research", "justification": "The summary mentions the use of experimental methods to validate theoretical models in chemistry research."}], "hypothetical_questions": [{"question_type": "Content-Based Question", "question": "How do academic papers in chemistry contribute to the advancement of scientific knowledge and understanding?"}, {"question_type": "Analytical Question", "question": "What are the key sections and components of academic papers in chemistry, and how do they facilitate the dissemination and comprehension of research findings?"}, {"question_type": "Creative/Scenario-Based Question", "question": "Imagine you are a researcher studying quantum dots. How would you structure and present your findings in an academic paper to effectively communicate your research to the scientific community?"}, {"question_type": "Contextual/Relational Question", "question": "How do computational methods, such as molecular replacement and direct-methods-aided model completion, contribute to protein structure prediction in academic papers in chemistry?"}, {"question_type": "User-Interactive Question", "question": "As a reader of academic papers in chemistry, how would you evaluate the reliability and reproducibility of the experimental methodologies presented in a research paper?"}], "knowledge_triplets": [{"subject": "Chemistry", "relationship": "is a field of study", "target": "Matter's composition, structure, properties, and changes during chemical reactions"}, {"subject": "Academic papers", "relationship": "serve as a medium for", "target": "Researchers to report their findings, discuss their significance, and contribute to the collective knowledge of the scientific community"}, {"subject": "Chemistry papers", "relationship": "adhere to a structured format", "target": "that facilitates the dissemination and comprehension of research findings"}, {"subject": "Chemistry papers", "relationship": "present complex information", "target": "in an organized and standardized manner"}, {"subject": "Chemistry papers", "relationship": "are crucial for", "target": "Peer review, reproducibility, and further research"}, {"subject": "Title", "relationship": "provides the first impression", "target": "of the research topic"}, {"subject": "Abstract", "relationship": "serves as a summary", "target": "of the research including the purpose, methodology, results, and conclusions"}, {"subject": "Introduction", "relationship": "sets the stage for the research", "target": "by providing background information, stating the research question, and justifying the study's importance"}, {"subject": "Introduction", "relationship": "includes a literature review", "target": "that situates the current research within the context of existing knowledge"}, {"subject": "Experimental Section or Methodology", "relationship": "details the procedures and materials used in the research", "target": "allowing other scientists to replicate the study if desired"}, {"subject": "Results", "relationship": "presents the data collected during the research", "target": "without interpretation"}, {"subject": "Discussion", "relationship": "interprets the results", "target": "explaining how the findings contribute to the field's understanding of the topic"}, {"subject": "Conclusion", "relationship": "summarizes the main findings and their implications", "target": "reinforcing the significance of the research"}, {"subject": "References", "relationship": "cites all the sources used in the paper", "target": "including articles, books, and other materials"}, {"subject": "Chemistry papers", "relationship": "employ various methodologies", "target": "depending on the research focus"}, {"subject": "Data presentation", "relationship": "in chemistry papers", "target": "is a meticulous process"}, {"subject": "Quantum dots and quantum dot assemblies", "relationship": "include methodologies on the synthesis of quantum dots", "target": "characterization techniques such as photoluminescence spectroscopy, and data on their energy conversion efficiencies"}, {"subject": "Protein structure prediction", "relationship": "includes computational methods", "target": "data on predicted structures, and comparisons with experimentally determined structures"}, {"subject": "Molecular polaritons", "relationship": "involve both experimental and theoretical methods", "target": "to determine and predict their properties"}, {"subject": "Chemistry", "relationship": "is a field that encompasses the study of matter's composition", "target": "structure, properties, and the changes it undergoes during chemical reactions"}, {"subject": "Chemistry papers", "relationship": "serve as a medium for researchers to report their findings", "target": "discuss their significance, and contribute to the collective knowledge of the scientific community"}, {"subject": "Chemistry papers", "relationship": "are crucial for peer review", "target": "reproducibility, and further research"}, {"subject": "Abstract", "relationship": "serves as a summary of the research", "target": "including the purpose, methodology, results, and conclusions"}, {"subject": "Introduction", "relationship": "provides background information", "target": "states the research question, and justifies the study's importance"}, {"subject": "Results", "relationship": "often includes figures", "target": "tables, and graphs to visually convey the findings"}, {"subject": "Discussion", "relationship": "researchers interpret their results", "target": "explaining how the findings contribute to the field's understanding of the topic"}, {"subject": "References", "relationship": "cites all the sources used in the paper", "target": "including articles, books, and other materials"}, {"subject": "Presentation of Data", "relationship": "uses figures", "target": "tables, and graphs to present data effectively"}, {"subject": "Quantum Dots and Quantum Dot Assemblies", "relationship": "include detailed methodologies on the synthesis of quantum dots", "target": "characterization techniques, and data on their energy conversion efficiencies"}, {"subject": "Protein Structure Prediction", "relationship": "combines structure prediction", "target": "molecular replacement, and direct-methods-aided model completion to solve protein structures"}, {"subject": "Protein Structure Prediction", "relationship": "includes computational methods", "target": "data on predicted structures, and comparisons with experimentally determined structures"}, {"subject": "Chemistry", "relationship": "encompasses the study of matter's composition", "target": "structure, properties, and changes during chemical reactions"}, {"subject": "Chemistry papers", "relationship": "serve as a medium for researchers to report their findings", "target": "discuss their significance, and contribute to the collective knowledge of the scientific community"}, {"subject": "Chemistry papers", "relationship": "are crucial for peer review", "target": "reproducibility, and further research"}, {"subject": "Abstract", "relationship": "serves as a summary of the research", "target": "including the purpose, methodology, results, and conclusions"}, {"subject": "Introduction", "relationship": "provides background information", "target": "states the research question, and justifies the study's importance"}, {"subject": "Results", "relationship": "often includes figures", "target": "tables, and graphs to visually convey the findings"}, {"subject": "Discussion", "relationship": "researchers interpret their results", "target": "explaining how the findings contribute to the field's understanding of the topic"}, {"subject": "References", "relationship": "cites all the sources used in the paper", "target": "including articles, books, and other materials"}, {"subject": "Presentation of Data", "relationship": "uses figures", "target": "tables, and graphs to present data effectively"}, {"subject": "Quantum Dots and Quantum Dot Assemblies", "relationship": "include detailed methodologies on the synthesis of quantum dots", "target": "characterization techniques, and data on their energy conversion efficiencies"}, {"subject": "Protein Structure Prediction", "relationship": "combines structure prediction", "target": "molecular replacement, and direct-methods-aided model completion to solve protein structures"}, {"subject": "Protein Structure Prediction", "relationship": "includes computational methods", "target": "data on predicted structures, and comparisons with experimentally determined structures"}], "timestamp": "2024-01-16T10:04:32.634459"}, {"file_id": "4706f52883e444c5a2a5fc86eff1b078", "article": "Chunk # 1.\nMethodologies must be robust and appropriate for the research question, and data must be presented in a way that is both accessible and informative As the field of chemistry continues to evolve, so too will the ways in which researchers communicate their findings, ensuring that the scientific community remains at the forefront of discovery and innovation \n## References\n\nAmerican Chemical Society (2023) ACS Spring 2024: Many Flavors of Chemistry Retrieved from http://phys-acs.org/event/acs-spring-2024-many-flavors-of-chemistry/\n\nInternational Union of Crystallography (2024) Solving protein structures by combining structure prediction, molecular replacement and direct-methods-aided model completion Retrieved from https://journals.iucr.org/m/issues/2024/02/00/lz5066/index.html\n\nLibreTexts (n.d.) Getting Familiar with Academic Journal Articles Retrieved from https://human.libretexts.org/Bookshelves/Composition/Advanced_Composition/How_Arguments_Work_-_A_Guide_to_Writing_and_Analyzing_Texts_in_College_(Mills)/06:_The_Research_Process/6.06:_Getting_Familiar_with_Academic_Journal_Articles\n\nNature Portfolio (n.d.) Chemistry Retrieved from https://www.nature.com/subjects/chemistry", "summary": "Researchers in the field of chemistry must use robust and appropriate methodologies to address their research questions. The presentation of data should be accessible and informative, facilitating communication within the scientific community. The evolving nature of chemistry requires researchers to continually adapt their methods of sharing findings, ensuring that the field remains at the forefront of discovery and innovation. [References: ACS Spring 2024, IUCr, LibreTexts, Nature Chemistry]", "clean_entities": [], "dirty_entities": ["Entities: methodologies", "research question", "data", "field of chemistry", "researchers", "scientific community", "discovery", "innovation", "American Chemical Society", "International Union of Crystallography", "LibreTexts", "Nature Portfolio", "", "Keywords: robust", "appropriate", "accessible", "informative", "evolve", "communicate", "findings", "forefront", "discovery", "innovation", "ACS Spring 2024", "flavors of chemistry", "solving protein structures", "structure prediction", "molecular replacement", "direct-methods-aided model completion", "academic journal articles", "chemistry", "", "Key Phrases: methodologies", "research question", "data", "accessible and informative", "field of chemistry", "communicate their findings", "scientific community", "forefront of discovery and innovation", "ACS Spring 2024", "many flavors of chemistry", "solving protein structures", "structure prediction", "molecular replacement", "direct-methods-aided model completion", "academic journal articles", "chemistry", "", "References: American Chemical Society (2023)", "International Union of Crystallography (2024)", "LibreTexts (n.d.)", "Nature Portfolio (n.d.)", "", "Abstract Concepts: robust methodologies", "appropriate research question", "accessible and informative data presentation", "evolving field of chemistry", "communication of findings", "scientific community", "forefront of discovery and innovation", "academic journal articles on chemistry"], "references": {"urls": ["http://phys-acs.org/event/acs-spring-2024-many-flavors-of-chemistry/", "https://journals.iucr.org/m/issues/2024/02/00/lz5066/index.html", "https://human.libretexts.org/Bookshelves/Composition/Advanced_Composition/How_Arguments_Work_-_A_Guide_to_Writing_and_Analyzing_Texts_in_College_(Mills)/06:_The_Research_Process/6.06:_Getting_Familiar_with_Academic_Journal_Articles", "https://www.nature.com/subjects/chemistry"], "references": "\n\nA list of references cites all the sources used in the paper, including articles, books, and other materials. This section is crucial for acknowledging the work of others and providing readers with resources for further reading.\n\n## Methodologies in Chemistry Papers\n\nChemistry papers employ various methodologies depending on the research focus. For example, experimental papers might describe laboratory procedures, while theoretical papers might focus on computational models or simulations. Methodologies are chosen based on their suitability to answer the research question and their ability to provide reliable and valid results.\n\n## Presentation of Data\n\nData presentation in chemistry papers is a meticulous process. Researchers use figures, tables, and graphs to present their data effectively. The choice of presentation style depends on the nature of the data and the best way to communicate the findings to the reader. For instance, spectroscopic data might be best represented by a graph, while crystallographic data might require a table or a structural diagram.\n\n## Analysis of Specific Chemistry Papers\n\n### Quantum Dots and Quantum Dot Assemblies\n\nIn the context of the ACS Spring 2024 meeting, one symposium focuses on the design of quantum dots for energy applications. Papers in this area would likely include detailed methodologies on the synthesis of quantum dots, characterization techniques such as photoluminescence spectroscopy, and data on their energy conversion efficiencies (American Chemical Society, 2023).\n\n### Protein Structure Prediction\n\nA paper from the Institute of Physics, Chinese Academy of Sciences, combines structure prediction, molecular replacement, and direct-methods-aided model completion to solve protein structures. This paper would include computational methods, data on predicted structures, and comparisons with experimentally determined structures (International Union of Crystallography, 2024).\n\n### Molecular Polaritons\n\nResearch on molecular polaritons would involve both experimental and theoretical methods to determine and predict their properties. Data presentation might include spectroscopic evidence of polariton formation and theoretical models predicting their behavior (American Chemical Society, 2023).\n\n## Conclusion\n\nThe structure of academic papers in chemistry is designed to provide a clear and systematic presentation of research. From the introduction to the conclusion, each section has a specific purpose that contributes to the overall narrative of the research. Methodologies must be robust and appropriate for the research question, and data must be presented in a way that is both accessible and informative. As the field of chemistry continues to evolve, so too will the ways in which researchers communicate their findings, ensuring that the scientific community remains at the forefront of discovery and innovation.\n\n\n\nAmerican Chemical Society. (2023). ACS Spring 2024: Many Flavors of Chemistry. Retrieved from http://phys-acs.org/event/acs-spring-2024-many-flavors-of-chemistry/\n\nInternational Union of Crystallography. (2024). Solving protein structures by combining structure prediction, molecular replacement and direct-methods-aided model completion. Retrieved from https://journals.iucr.org/m/issues/2024/02/00/lz5066/index.html\n\nLibreTexts. (n.d.). Getting Familiar with Academic Journal Articles. Retrieved from https://human.libretexts.org/Bookshelves/Composition/Advanced_Composition/How_Arguments_Work_-_A_Guide_to_Writing_and_Analyzing_Texts_in_College_(Mills)/06:_The_Research_Process/6.06:_Getting_Familiar_with_Academic_Journal_Articles\n\nNature Portfolio. (n.d.). Chemistry. Retrieved from https://www.nature.com/subjects/chemistry"}, "topics": [{"topic": "Importance of robust and appropriate methodologies in chemistry research", "justification": "The summary emphasizes the need for researchers in chemistry to use robust and appropriate methodologies to address their research questions."}, {"topic": "Accessibility and informativeness of data presentation in chemistry research", "justification": "The summary highlights the importance of presenting data in a way that is accessible and informative, facilitating communication within the scientific community."}, {"topic": "Adaptation of methods for sharing findings in chemistry research", "justification": "The summary mentions the evolving nature of chemistry and the need for researchers to continually adapt their methods of sharing findings to ensure that the field remains at the forefront of discovery and innovation."}], "hypothetical_questions": [{"question_type": "Content-Based Question", "question": "How can researchers in chemistry ensure that their methodologies are robust and appropriate for addressing their research questions?"}, {"question_type": "Analytical Question", "question": "What are some key factors that researchers in chemistry should consider when presenting their data in a way that is accessible and informative to the scientific community?"}, {"question_type": "Creative/Scenario-Based Question", "question": "Imagine a scenario where a new discovery in chemistry challenges the existing methods of sharing findings. How can researchers adapt their approaches to ensure that the field remains at the forefront of discovery and innovation?"}, {"question_type": "Contextual/Relational Question", "question": "How does the evolving nature of chemistry impact the way researchers share their findings, and how does this contribute to the overall advancement of the field?"}, {"question_type": "User-Interactive Question", "question": "As a researcher in chemistry, what strategies would you employ to ensure that your methodologies are robust, your data presentation is accessible, and your findings contribute to the ongoing innovation in the field?"}], "knowledge_triplets": [{"subject": "Methodologies", "relationship": "must be robust and appropriate for", "target": "research question"}, {"subject": "data", "relationship": "must be presented in", "target": "way that is both accessible and informative"}, {"subject": "field of chemistry", "relationship": "continues to evolve", "target": "ways in which researchers communicate their findings"}, {"subject": "scientific community", "relationship": "remains at the forefront of", "target": "discovery and innovation"}, {"subject": "methodologies", "relationship": "are robust and appropriate for", "target": "the research question"}, {"subject": "data", "relationship": "must be presented in a way that is", "target": "both accessible and informative"}, {"subject": "field of chemistry", "relationship": "continues to evolve", "target": "the ways in which researchers communicate their findings"}, {"subject": "field of chemistry", "relationship": "ensures that the scientific community remains", "target": "at the forefront of discovery and innovation"}, {"subject": "Methodologies", "relationship": "must be robust and appropriate for", "target": "research question"}, {"subject": "data", "relationship": "must be presented in", "target": "way that is both accessible and informative"}, {"subject": "field of chemistry", "relationship": "continues to evolve", "target": "ways in which researchers communicate their findings"}, {"subject": "scientific community", "relationship": "remains at the forefront of", "target": "discovery and innovation"}], "timestamp": "2024-01-16T10:04:50.826593"}]