[
    {
        "file_id": "6f37373983f54caf8eae14058cb786c8",
        "article": "Chunk # 0.\n# Ethical Guidelines and Safety Measures for Mitochondrial Manipulation in Therapeutic Applications\n\n## Introduction\n\nMitochondrial diseases are a group of disorders caused by dysfunctional mitochondria, the organelles that generate energy for the cell Mitochondrial manipulation, particularly in the form of gene therapy, holds promise for treating these diseases However, the ethical implications and safety concerns associated with such interventions are complex and multifaceted This report outlines the necessary ethical guidelines and safety measures that must be established to responsibly pursue mitochondrial manipulation in therapeutic applications \n## Ethical Considerations\n\n### Informed Consent\n\nInformed consent is a cornerstone of ethical medical practice Patients and, in the case of minors, their guardians, must be fully informed about the potential risks and benefits of mitochondrial manipulation therapies This includes a clear explanation of the novel aspects of such treatments and the uncertainties involved (National Academies of Sciences, Engineering, and Medicine, 2016) The consent process should also address the potential for germline transmission and the implications this may have for future generations \n### Germline Modification and Intergenerational Impact\n\nMitochondrial manipulation often involves changes that can be passed on to offspring, raising concerns about germline modification Ethical guidelines must address whether and under what circumstances it is permissible to make changes that affect the human germline The potential long-term effects on the gene pool and the rights of future generations to an unaltered genome must be carefully weighed (National Academies of Sciences, Engineering, and Medicine, 2016) \n### Equity of Access\n\nAccess to mitochondrial manipulation therapies should be equitable and not limited by socioeconomic status Guidelines must ensure that these therapies are available to all affected individuals, not just those who can afford them \n### Oversight and Regulation\n\nRegulatory oversight is essential to ensure the safety and efficacy of mitochondrial manipulation therapies The U.S Food and Drug Administration (FDA) and other regulatory bodies must establish clear guidelines for the preclinical and clinical evaluation of these therapies International consensus is also needed to prevent uncontrolled proliferation of the techniques and to ensure that applications are carried out within the well-regulated framework of clinical trials (Klopstock, Klopstock, & Prokisch, 2016) \n## Safety Measures\n\n### Preclinical Studies\n\nBefore mitochondrial manipulation can be ethically used in the clinic, its safety and effectiveness must be established through rigorous preclinical research This includes studies in cell models and animal systems to assess the potential for off-target effects, immune responses, and other adverse outcomes (Dondorp & de Wert, 2011) \n### Clinical Trial Design\n\nClinical trials for mitochondrial manipulation therapies must be carefully designed to protect participants This includes selecting appropriate endpoints, establishing criteria for participant selection, and determining the timing and methods for assessing safety and efficacy Trials should also include long-term follow-up to monitor for delayed adverse effects \n### Mitochondrial Heteroplasmy Management\n\nMitochondrial diseases often involve a mixture of healthy and mutated mitochondria, known as heteroplasmy Therapies must be designed to shift the balance toward healthy mitochondria without causing unintended consequences Techniques such as mitochondrial targeted restriction endonucleases have shown promise in this regard (Bayona-Bafaluy et al., 2005) \n### Delivery Systems\n\nThe delivery of gene-editing tools to mitochondria presents unique challenges Safety measures must ensure that delivery systems are specific to mitochondria and do not affect nuclear DNA This includes the development of mitochondrial-targeted vectors and the careful selection of editing enzymes (Gammage et al., 2018) \n### Monitoring and Management of Adverse Events\n\nPhysicians administering mitochondrial manipulation therapies should perform careful clinical and laboratory follow-up to promptly recognize and treat possible side effects, such as rhabdomyolysis, lactic acidosis, and hepatic failure (Jones et al., 2016) \n## Conclusion\n\nMitochondrial manipulation in therapeutic applications offers a promising avenue for treating mitochondrial diseases However, the ethical and safety considerations are significant and require careful attention Informed consent, germline modification considerations, equitable access, regulatory oversight, preclinical studies, clinical trial design, heteroplasmy management, delivery systems, and adverse event monitoring are all critical components that must be addressed in ethical guidelines and safety measures By establishing comprehensive and robust frameworks, we can ensure that mitochondrial manipulation therapies are developed and implemented responsibly, maximizing patient benefit while minimizing risk \n## References\n\nBayona-Bafaluy, M P., Blits, B., Battersby, B J., Shoubridge, E A., & Moraes, C T (2005) Rapid directional shift of mitochondrial DNA heteroplasmy in animal tissues by a mitochondrially targeted restriction endonuclease *Proc Natl Acad Sci USA*, 102(37), 14392–14397 https://doi.org/10.1073/pnas.0506544102\n\nDondorp, W., & de Wert, G (2011) The 'thousand-dollar genome': an ethical exploration *European Journal of Human Genetics*, 19(Suppl 1), S6–S26 https://doi.org/10.1038/ejhg.2011.150\n\nGammage, P A., et al (2018) Genome editing in mitochondria corrects a pathogenic mtDNA mutation in vivo *Nat Med.*, 24(11), 1691–1695 https://doi.org/10.1038/s41591-018-0165-9\n\nJones, H., et al (2016) Safety of Drug Use in MDs *Journal of Inherited Metabolic Disease* https://www.ncbi.nlm.nih.gov/pmc/articles/PMC7794679/\n\nKlopstock, T., Klopstock, B., & Prokisch, H (2016) Mitochondrial replacement approaches: challenges for clinical implementation",
        "summary": "## Ethical Guidelines and Safety Measures for Mitochondrial Manipulation in Therapeutic Applications\n\n1. Informed consent is crucial, ensuring patients and guardians understand the risks, benefits, and uncertainties of mitochondrial manipulation therapies.\n2. Germline modification raises concerns about hereditary impact and the rights of future generations, necessitating careful consideration and guidelines.\n3. Equitable access to mitochondrial manipulation therapies must be ensured, preventing limitations based on socioeconomic status.\n4. Regulatory oversight by bodies like the FDA is essential to establish safety and efficacy guidelines and prevent uncontrolled proliferation.\n5. Preclinical studies are necessary to establish the safety and effectiveness of mitochondrial manipulation, including assessing potential adverse effects.\n6. Clinical trials must be designed to protect participants, with appropriate endpoints, participant selection criteria, and long-term follow-up.\n7. Mitochondrial heteroplasmy management is crucial, aiming to shift the balance towards healthy mitochondria without unintended consequences.\n8. Delivery systems for gene-editing tools must be specific to mitochondria, ensuring no impact on nuclear DNA.\n9. Monitoring and prompt treatment of adverse events, such as rhabdomyolysis and hepatic failure, are essential during mitochondrial manipulation therapies.\n\nBy addressing these ethical guidelines and safety measures comprehensively, mitochondrial manipulation therapies can be responsibly developed and implemented, maximizing benefits while minimizing risks.",
        "clean_entities": [],
        "dirty_entities": [
            "Entities: mitochondrial diseases",
            "dysfunctional mitochondria",
            "gene therapy",
            "ethical implications",
            "safety concerns",
            "ethical guidelines",
            "safety measures",
            "informed consent",
            "potential risks",
            "benefits",
            "uncertainties",
            "germline transmission",
            "intergenerational impact",
            "germline modification",
            "gene pool",
            "unaltered genome",
            "equity of access",
            "socioeconomic status",
            "regulatory oversight",
            "U.S Food and Drug Administration (FDA)",
            "preclinical studies",
            "clinical trial design",
            "participant selection",
            "safety and efficacy",
            "long-term follow-up",
            "mitochondrial heteroplasmy",
            "delivery systems",
            "gene-editing tools",
            "monitoring",
            "adverse events",
            "physicians",
            "rhabdomyolysis",
            "lactic acidosis",
            "hepatic failure",
            "therapeutic applications",
            "patient benefit",
            "risk",
            "",
            "Keywords: mitochondrial manipulation",
            "therapeutic applications",
            "ethical considerations",
            "informed consent",
            "germline modification",
            "intergenerational impact",
            "equity of access",
            "oversight and regulation",
            "safety measures",
            "preclinical studies",
            "clinical trial design",
            "mitochondrial heteroplasmy management",
            "delivery systems",
            "monitoring",
            "adverse events",
            "conclusion",
            "",
            "Key Phrases: mitochondrial diseases",
            "dysfunctional mitochondria",
            "gene therapy",
            "ethical implications",
            "safety concerns",
            "ethical guidelines",
            "safety measures",
            "informed consent",
            "potential risks and benefits",
            "uncertainties involved",
            "germline transmission",
            "intergenerational impact",
            "germline modification",
            "equity of access",
            "regulatory oversight",
            "preclinical studies",
            "clinical trial design",
            "mitochondrial heteroplasmy management",
            "delivery systems",
            "adverse events",
            "patient benefit",
            "minimizing risk",
            "",
            "References: National Academies of Sciences",
            "Engineering",
            "and Medicine",
            "2016; Klopstock",
            "Klopstock",
            "& Prokisch",
            "2016; Dondorp & de Wert",
            "2011; Bayona-Bafaluy et al.",
            "2005; Gammage et al.",
            "2018; Jones et al.",
            "2016"
        ],
        "references": {
            "urls": [
                "https://doi.org/10.1073/pnas.0506544102",
                "https://doi.org/10.1038/ejhg.2011.150",
                "https://doi.org/10.1038/s41591-018-0165-9",
                "https://www.ncbi.nlm.nih.gov/pmc/articles/PMC7794679/",
                "https://doi.org/10.1186/s13073-016-0380-2",
                "https://doi.org/10.17226/21871"
            ],
            "references": "\n\nBayona-Bafaluy, M. P., Blits, B., Battersby, B. J., Shoubridge, E. A., & Moraes, C. T. (2005). Rapid directional shift of mitochondrial DNA heteroplasmy in animal tissues by a mitochondrially targeted restriction endonuclease. *Proc. Natl Acad. Sci. USA*, 102(37), 14392–14397. https://doi.org/10.1073/pnas.0506544102\n\nDondorp, W., & de Wert, G. (2011). The 'thousand-dollar genome': an ethical exploration. *European Journal of Human Genetics*, 19(Suppl 1), S6–S26. https://doi.org/10.1038/ejhg.2011.150\n\nGammage, P. A., et al. (2018). Genome editing in mitochondria corrects a pathogenic mtDNA mutation in vivo. *Nat. Med.*, 24(11), 1691–1695. https://doi.org/10.1038/s41591-018-0165-9\n\nJones, H., et al. (2016). Safety of Drug Use in MDs. *Journal of Inherited Metabolic Disease*. https://www.ncbi.nlm.nih.gov/pmc/articles/PMC7794679/\n\nKlopstock, T., Klopstock, B., & Prokisch, H. (2016). Mitochondrial replacement approaches: challenges for clinical implementation. *Genome Medicine*, 8(1), 126. https://doi.org/10.1186/s13073-016-0380-2\n\nNational Academies of Sciences, Engineering, and Medicine. (2016). *Mitochondrial Replacement Techniques: Ethical, Social, and Policy Considerations*. The National Academies Press. https://doi.org/10.17226/21871"
        },
        "topics": [
            {
                "topic": "Informed Consent in Mitochondrial Manipulation Therapies",
                "justification": "Informed consent is crucial to ensure patients and guardians understand the risks, benefits, and uncertainties of mitochondrial manipulation therapies."
            },
            {
                "topic": "Ethical Concerns of Germline Modification in Mitochondrial Manipulation",
                "justification": "Germline modification raises concerns about hereditary impact and the rights of future generations, necessitating careful consideration and guidelines."
            },
            {
                "topic": "Ensuring Equitable Access to Mitochondrial Manipulation Therapies",
                "justification": "Equitable access to mitochondrial manipulation therapies must be ensured, preventing limitations based on socioeconomic status."
            },
            {
                "topic": "Regulatory Oversight in Mitochondrial Manipulation Therapies",
                "justification": "Regulatory oversight by bodies like the FDA is essential to establish safety and efficacy guidelines and prevent uncontrolled proliferation."
            },
            {
                "topic": "Importance of Preclinical Studies in Mitochondrial Manipulation Therapies",
                "justification": "Preclinical studies are necessary to establish the safety and effectiveness of mitochondrial manipulation, including assessing potential adverse effects."
            },
            {
                "topic": "Designing Ethical Clinical Trials for Mitochondrial Manipulation Therapies",
                "justification": "Clinical trials must be designed to protect participants, with appropriate endpoints, participant selection criteria, and long-term follow-up."
            },
            {
                "topic": "Managing Mitochondrial Heteroplasmy in Therapeutic Applications",
                "justification": "Mitochondrial heteroplasmy management is crucial, aiming to shift the balance towards healthy mitochondria without unintended consequences."
            },
            {
                "topic": "Specificity of Delivery Systems for Mitochondrial Gene Editing",
                "justification": "Delivery systems for gene-editing tools must be specific to mitochondria, ensuring no impact on nuclear DNA."
            },
            {
                "topic": "Monitoring and Treatment of Adverse Events in Mitochondrial Manipulation Therapies",
                "justification": "Monitoring and prompt treatment of adverse events, such as rhabdomyolysis and hepatic failure, are essential during mitochondrial manipulation therapies."
            }
        ],
        "hypothetical_questions": [
            {
                "question_type": "Content-Based Question",
                "question": "What are the key considerations for ensuring informed consent in mitochondrial manipulation therapies?"
            },
            {
                "question_type": "Analytical Question",
                "question": "How can regulatory bodies like the FDA effectively oversee mitochondrial manipulation therapies to ensure safety and efficacy?"
            },
            {
                "question_type": "Creative/Scenario-Based Question",
                "question": "Imagine a scenario where mitochondrial manipulation therapies become widely available. How can equitable access be ensured for individuals of all socioeconomic backgrounds?"
            },
            {
                "question_type": "Contextual/Relational Question",
                "question": "How does the management of mitochondrial heteroplasmy contribute to the safety and effectiveness of mitochondrial manipulation therapies?"
            },
            {
                "question_type": "User-Interactive Question",
                "question": "What are some potential adverse events that may occur during mitochondrial manipulation therapies, and how can they be effectively monitored and treated?"
            }
        ],
        "knowledge_triplets": [
            {
                "subject": "Mitochondrial diseases",
                "relationship": "caused by",
                "target": "dysfunctional mitochondria"
            },
            {
                "subject": "Mitochondrial manipulation",
                "relationship": "holds promise for treating",
                "target": "mitochondrial diseases"
            },
            {
                "subject": "Ethical implications and safety concerns",
                "relationship": "associated with",
                "target": "mitochondrial manipulation"
            },
            {
                "subject": "Ethical guidelines",
                "relationship": "must be established",
                "target": "to responsibly pursue mitochondrial manipulation"
            },
            {
                "subject": "Patients and their guardians",
                "relationship": "must be fully informed about",
                "target": "potential risks and benefits of mitochondrial manipulation therapies"
            },
            {
                "subject": "Consent process",
                "relationship": "should address",
                "target": "potential for germline transmission"
            },
            {
                "subject": "Germline modification",
                "relationship": "raises concerns about",
                "target": "future generations"
            },
            {
                "subject": "Ethical guidelines",
                "relationship": "must address",
                "target": "permissibility of changes affecting human germline"
            },
            {
                "subject": "Mitochondrial diseases",
                "relationship": "caused by",
                "target": "dysfunctional mitochondria"
            },
            {
                "subject": "Mitochondrial manipulation",
                "relationship": "holds promise for treating",
                "target": "mitochondrial diseases"
            },
            {
                "subject": "Ethical implications and safety concerns",
                "relationship": "associated with",
                "target": "mitochondrial manipulation"
            },
            {
                "subject": "Informed consent",
                "relationship": "cornerstone of",
                "target": "ethical medical practice"
            },
            {
                "subject": "Patients and guardians",
                "relationship": "must be fully informed about",
                "target": "potential risks and benefits of mitochondrial manipulation therapies"
            },
            {
                "subject": "Consent process",
                "relationship": "should address",
                "target": "potential for germline transmission"
            },
            {
                "subject": "Ethical guidelines",
                "relationship": "must address",
                "target": "permissibility of changes that affect the human germline"
            },
            {
                "subject": "Guidelines",
                "relationship": "must ensure",
                "target": "therapies are available to all affected individuals"
            },
            {
                "subject": "Regulatory oversight",
                "relationship": "essential to ensure",
                "target": "safety and efficacy of mitochondrial manipulation therapies"
            },
            {
                "subject": "U.S Food and Drug Administration (FDA)",
                "relationship": "must establish clear guidelines for",
                "target": "evaluation of these therapies"
            },
            {
                "subject": "Preclinical research",
                "relationship": "necessary to establish",
                "target": "safety and effectiveness of mitochondrial manipulation"
            },
            {
                "subject": "Clinical trials",
                "relationship": "must be carefully designed to protect",
                "target": "participants"
            },
            {
                "subject": "Mitochondrial diseases",
                "relationship": "often involve",
                "target": "mixture of healthy and mutated mitochondria"
            },
            {
                "subject": "Physicians",
                "relationship": "should perform careful clinical and laboratory follow-up to recognize and treat",
                "target": "possible side effects of mitochondrial manipulation therapies"
            },
            {
                "subject": "Mitochondrial manipulation therapies",
                "relationship": "offer a promising avenue for treating",
                "target": "mitochondrial diseases"
            },
            {
                "subject": "Mitochondrial diseases",
                "relationship": "caused by",
                "target": "dysfunctional mitochondria"
            },
            {
                "subject": "Mitochondrial manipulation",
                "relationship": "holds promise for treating",
                "target": "mitochondrial diseases"
            },
            {
                "subject": "Ethical implications and safety concerns",
                "relationship": "associated with",
                "target": "mitochondrial manipulation"
            },
            {
                "subject": "Informed consent",
                "relationship": "cornerstone of",
                "target": "ethical medical practice"
            },
            {
                "subject": "Patients and guardians",
                "relationship": "must be fully informed about",
                "target": "potential risks and benefits of mitochondrial manipulation therapies"
            },
            {
                "subject": "Consent process",
                "relationship": "should address",
                "target": "potential for germline transmission"
            },
            {
                "subject": "Ethical guidelines",
                "relationship": "must address",
                "target": "permissibility of changes that affect the human germline"
            },
            {
                "subject": "Guidelines",
                "relationship": "must ensure",
                "target": "therapies are available to all affected individuals"
            },
            {
                "subject": "Regulatory oversight",
                "relationship": "essential to ensure",
                "target": "safety and efficacy of mitochondrial manipulation therapies"
            },
            {
                "subject": "U.S Food and Drug Administration (FDA)",
                "relationship": "must establish clear guidelines for",
                "target": "evaluation of these therapies"
            },
            {
                "subject": "Preclinical research",
                "relationship": "necessary to establish",
                "target": "safety and effectiveness of mitochondrial manipulation"
            },
            {
                "subject": "Clinical trials",
                "relationship": "must be carefully designed to protect",
                "target": "participants"
            },
            {
                "subject": "Mitochondrial diseases",
                "relationship": "often involve",
                "target": "mixture of healthy and mutated mitochondria"
            },
            {
                "subject": "Physicians",
                "relationship": "should perform careful clinical and laboratory follow-up to recognize and treat",
                "target": "possible side effects of mitochondrial manipulation therapies"
            },
            {
                "subject": "Mitochondrial manipulation therapies",
                "relationship": "offer a promising avenue for treating",
                "target": "mitochondrial diseases"
            }
        ],
        "timestamp": "2024-01-10T16:36:05.411977"
    },
    {
        "file_id": "6f37373983f54caf8eae14058cb786c8",
        "article": "Chunk # 1.\n*Genome Medicine*, 8(1), 126 https://doi.org/10.1186/s13073-016-0380-2\n\nNational Academies of Sciences, Engineering, and Medicine (2016) *Mitochondrial Replacement Techniques: Ethical, Social, and Policy Considerations* The National Academies Press https://doi.org/10.17226/21871",
        "summary": "Revised Summary: The National Academies of Sciences address ethical, social, and policy considerations of mitochondrial replacement techniques in their article titled \"Mitochondrial Replacement Techniques: Ethical, Social, and Policy Considerations\" published in the scientific journal *Genome Medicine* in 2016. The National Academies Press provides guidance on ethical, social, and policy considerations for genome medicine, including mitochondrial replacement techniques.",
        "clean_entities": [
            "Genome Medicine",
            "National Academies of Sciences",
            "Mitochondrial Replacement Techniques",
            "Ethical",
            "The National Academies Press",
            "Genome Medicine",
            "Mitochondrial Replacement Techniques",
            "Ethical",
            "Social",
            "Policy Considerations",
            "National Academies of Sciences",
            "The National Academies Press",
            "Genome Medicine",
            "Mitochondrial Replacement Techniques: Ethical",
            "The National Academies Press",
            "National Academies of Sciences",
            "Genome Medicine",
            "The National Academies Press",
            "National Academies of Sciences",
            "Genome medicine",
            "Ethical considerations",
            "Social considerations",
            "Policy considerations",
            "Mitochondrial replacement techniques"
        ],
        "dirty_entities": [
            "**Entities**:",
            "Engineering",
            "and Medicine",
            "Social",
            "and Policy Considerations",
            "",
            "**Keywords**:",
            "Engineering",
            "and Medicine",
            "",
            "**Key Phrases**:",
            "8(1)",
            "126",
            "Social",
            "and Policy Considerations",
            "Engineering",
            "and Medicine",
            "",
            "**References**:",
            "8(1)",
            "126",
            "Engineering",
            "and Medicine",
            "",
            "**Abstract Concepts**:"
        ],
        "references": {
            "urls": [
                "https://doi.org/10.1073/pnas.0506544102",
                "https://doi.org/10.1038/ejhg.2011.150",
                "https://doi.org/10.1038/s41591-018-0165-9",
                "https://www.ncbi.nlm.nih.gov/pmc/articles/PMC7794679/",
                "https://doi.org/10.1186/s13073-016-0380-2",
                "https://doi.org/10.17226/21871"
            ],
            "references": "\n\nBayona-Bafaluy, M. P., Blits, B., Battersby, B. J., Shoubridge, E. A., & Moraes, C. T. (2005). Rapid directional shift of mitochondrial DNA heteroplasmy in animal tissues by a mitochondrially targeted restriction endonuclease. *Proc. Natl Acad. Sci. USA*, 102(37), 14392–14397. https://doi.org/10.1073/pnas.0506544102\n\nDondorp, W., & de Wert, G. (2011). The 'thousand-dollar genome': an ethical exploration. *European Journal of Human Genetics*, 19(Suppl 1), S6–S26. https://doi.org/10.1038/ejhg.2011.150\n\nGammage, P. A., et al. (2018). Genome editing in mitochondria corrects a pathogenic mtDNA mutation in vivo. *Nat. Med.*, 24(11), 1691–1695. https://doi.org/10.1038/s41591-018-0165-9\n\nJones, H., et al. (2016). Safety of Drug Use in MDs. *Journal of Inherited Metabolic Disease*. https://www.ncbi.nlm.nih.gov/pmc/articles/PMC7794679/\n\nKlopstock, T., Klopstock, B., & Prokisch, H. (2016). Mitochondrial replacement approaches: challenges for clinical implementation. *Genome Medicine*, 8(1), 126. https://doi.org/10.1186/s13073-016-0380-2\n\nNational Academies of Sciences, Engineering, and Medicine. (2016). *Mitochondrial Replacement Techniques: Ethical, Social, and Policy Considerations*. The National Academies Press. https://doi.org/10.17226/21871"
        },
        "topics": [
            {
                "topic": "\"Mitochondrial Replacement Techniques: Ethical, Social, and Policy Considerations\"",
                "justification": "The summary mentions this specific article as the main focus of the National Academies of Sciences' work. It highlights the importance of addressing ethical, social, and policy considerations related to mitochondrial replacement techniques."
            },
            {
                "topic": "\"Guidance on Ethical, Social, and Policy Considerations for Genome Medicine\"",
                "justification": "The summary mentions that the National Academies Press provides guidance on ethical, social, and policy considerations for genome medicine, including mitochondrial replacement techniques. This topic emphasizes the broader scope of the National Academies' work in providing guidance in the field of genome medicine."
            },
            {
                "topic": "\"Ethical Considerations of Mitochondrial Replacement Techniques\"",
                "justification": "The summary mentions that the National Academies address ethical considerations of mitochondrial replacement techniques. This topic focuses specifically on the ethical aspects of these techniques and their implications."
            },
            {
                "topic": "\"Social Considerations of Mitochondrial Replacement Techniques\"",
                "justification": "The summary mentions that the National Academies address social considerations of mitochondrial replacement techniques. This topic highlights the social implications and considerations related to the use of these techniques."
            },
            {
                "topic": "\"Policy Considerations of Mitochondrial Replacement Techniques\"",
                "justification": "The summary mentions that the National Academies address policy considerations of mitochondrial replacement techniques. This topic emphasizes the importance of policy development and regulation in relation to these techniques."
            }
        ],
        "hypothetical_questions": [
            {
                "question_type": "Content-Based Question",
                "question": "What are some of the key ethical, social, and policy considerations addressed by the National Academies of Sciences in their article on mitochondrial replacement techniques?"
            },
            {
                "question_type": "Analytical Question",
                "question": "How can the guidance provided by the National Academies Press on ethical, social, and policy considerations for genome medicine, including mitochondrial replacement techniques, contribute to the advancement of scientific research and responsible implementation?"
            },
            {
                "question_type": "Creative/Scenario-Based Question",
                "question": "Imagine a society where mitochondrial replacement techniques are widely accepted and used. How might this impact societal norms, family structures, and the concept of genetic inheritance?"
            },
            {
                "question_type": "Contextual/Relational Question",
                "question": "How do the ethical, social, and policy considerations discussed in the article by the National Academies of Sciences on mitochondrial replacement techniques relate to broader debates surrounding reproductive technologies and genetic engineering?"
            },
            {
                "question_type": "User-Interactive Question",
                "question": "What are your personal thoughts on the ethical, social, and policy considerations of mitochondrial replacement techniques? How do you think these considerations should be addressed in the development and implementation of such technologies?"
            }
        ],
        "knowledge_triplets": [
            {
                "subject": "Genome Medicine",
                "relationship": "is a journal of",
                "target": "National Academies of Sciences"
            },
            {
                "subject": "Mitochondrial Replacement Techniques",
                "relationship": "is a topic in",
                "target": "Ethical considerations"
            },
            {
                "subject": "Mitochondrial Replacement Techniques",
                "relationship": "is a topic in",
                "target": "Social considerations"
            },
            {
                "subject": "Mitochondrial Replacement Techniques",
                "relationship": "is a topic in",
                "target": "Policy considerations"
            },
            {
                "subject": "National Academies of Sciences",
                "relationship": "published the article",
                "target": "The National Academies Press"
            },
            {
                "subject": "Genome Medicine",
                "relationship": "published the article",
                "target": "Mitochondrial Replacement Techniques"
            },
            {
                "subject": "Mitochondrial Replacement Techniques: Ethical",
                "relationship": "is a book by",
                "target": "The National Academies Press"
            },
            {
                "subject": "National Academies of Sciences",
                "relationship": "published the book",
                "target": "The National Academies Press"
            },
            {
                "subject": "Genome Medicine",
                "relationship": "published the book",
                "target": "Mitochondrial Replacement Techniques"
            },
            {
                "subject": "National Academies of Sciences",
                "relationship": "published the book",
                "target": "Mitochondrial Replacement Techniques"
            },
            {
                "subject": "National Academies of Sciences",
                "relationship": "Engineering",
                "target": "and Medicine, is the author of, Mitochondrial Replacement Techniques: Ethical, Social, and Policy Considerations"
            },
            {
                "subject": "Mitochondrial Replacement Techniques: Ethical",
                "relationship": "Social",
                "target": "and Policy Considerations, is published by, The National Academies Press"
            },
            {
                "subject": "Genome Medicine",
                "relationship": "is a journal of",
                "target": "National Academies of Sciences"
            },
            {
                "subject": "Mitochondrial Replacement Techniques",
                "relationship": "is a topic in",
                "target": "Ethical considerations"
            },
            {
                "subject": "Mitochondrial Replacement Techniques",
                "relationship": "is a topic in",
                "target": "Social considerations"
            },
            {
                "subject": "Mitochondrial Replacement Techniques",
                "relationship": "is a topic in",
                "target": "Policy considerations"
            },
            {
                "subject": "National Academies of Sciences",
                "relationship": "published the article",
                "target": "The National Academies Press"
            },
            {
                "subject": "Genome Medicine",
                "relationship": "published the article",
                "target": "Mitochondrial Replacement Techniques"
            },
            {
                "subject": "Mitochondrial Replacement Techniques: Ethical",
                "relationship": "is a book by",
                "target": "The National Academies Press"
            },
            {
                "subject": "National Academies of Sciences",
                "relationship": "published the book",
                "target": "The National Academies Press"
            },
            {
                "subject": "Genome Medicine",
                "relationship": "published the book",
                "target": "Mitochondrial Replacement Techniques"
            },
            {
                "subject": "National Academies of Sciences",
                "relationship": "published the book",
                "target": "Mitochondrial Replacement Techniques"
            },
            {
                "subject": "National Academies of Sciences",
                "relationship": "Engineering",
                "target": "and Medicine, is the author of, Mitochondrial Replacement Techniques: Ethical, Social, and Policy Considerations"
            },
            {
                "subject": "Mitochondrial Replacement Techniques: Ethical",
                "relationship": "Social",
                "target": "and Policy Considerations, is published by, The National Academies Press"
            }
        ],
        "timestamp": "2024-01-10T16:36:37.911883"
    }
]